id,date,name,desc,link,icon
1399,09-22,Eistüte,Feiertag für die Eistüte,https://www.kuriose-feiertage.de/tag-der-eistuete/,icecream
1400,09-22,Flüsse,Feiertag für Flüsse,https://www.kuriose-feiertage.de/world-rivers-day/,waves
1401,09-22,Autofrei,Feiertag für den autofreien Tag,https://www.kuriose-feiertage.de/autofreier-tag/,directions_car
1402,09-22,Weiße Schokolade,Feiertag für weiße Schokolade,https://www.kuriose-feiertage.de/tag-der-weissen-schokolade/,cake
1403,09-22,Hobbit,Feiertag für die Hobbits,https://www.kuriose-feiertage.de/hobbit-tag/,theaters
1404,09-22,Welt Nashorn Tag,Feiertag zum Schutz der Nashörner,https://www.kuriose-feiertage.de/world-rhino-day/,pets
1405,09-23,Thrue Bab,Feiertag für das Ende des Monsuns in Bhutan,https://www.kuriose-feiertage.de/thrue-bab-in-bhutan/,rain
1406,09-23,Internationaler Tag der Gebärdensprachen,Feiertag zur Anerkennung der Gebärdensprachen,https://www.kuriose-feiertage.de/internationaler-tag-der-gebaerdensprachen/,accessibility
1407,09-23,Herbstspaziergang,Feiertag für einen Spaziergang im Herbst,https://www.kuriose-feiertage.de/tag-des-herbstspaziergangs/,directions_walk
1408,09-23,Dogs in Politics Day,Feiertag für politische Hunde,https://www.kuriose-feiertage.de/dogs-in-politics-day/,pets
1409,09-23,Bisexualität,Feiertag zur Feier der Bisexualität,https://www.kuriose-feiertage.de/tag-der-bisexualitaet/,transgender
1410,09-24,Gorillas,Feiertag für den Schutz der Gorillas,https://www.kuriose-feiertage.de/welttag-der-gorillas/,pets
1411,09-24,Braai,Feiertag für das traditionelle südafrikanische Grillen,https://www.kuriose-feiertage.de/tag-des-braai/,local_dining
1412,09-24,Kirsch Soufflé,Feiertag für das Kirsch Soufflé,https://www.kuriose-feiertage.de/tag-des-kirsch-souffles/,cake
1413,09-24,Satzzeichen,Feiertag zur Wertschätzung der Satzzeichen,https://www.kuriose-feiertage.de/tag-der-satzzeichen/,format_paint
1414,09-25,Comics,Feiertag für Comic-Bücher,https://www.kuriose-feiertage.de/tag-der-comics/,book
1415,09-25,Kochkunst,Feiertag zum Kochen,https://www.kuriose-feiertage.de/tag-des-kochens/,restaurant
1416,09-25,Zahngesundheit,Feiertag für Zahngesundheit in Deutschland,https://www.kuriose-feiertage.de/tag-der-zahngesundheit/,healing
1417,09-26,Schifffahrt,Feiertag für die Schifffahrt,https://www.kuriose-feiertage.de/weltschifffahrtstag/,directions_boat
1418,09-26,Gesundes Frühstück,Feiertag für ein besseres Frühstück,https://www.kuriose-feiertage.de/tag-des-gesunden-fruehstuecks/,restaurant_menu
1419,09-26,Liebesbrief,Feiertag für das Schreiben von Liebesbriefen,https://www.kuriose-feiertage.de/tag-des-liebesbriefchens/,favorite_border
1420,09-26,Pfannkuchen,Feiertag für Pfannkuchen,https://www.kuriose-feiertage.de/tag-der-pfannkuchen-usa/,cake
1421,09-26,Holzfäller,Feiertag für die Holzfäller,https://www.kuriose-feiertage.de/holzfaeller-tag/,tools
1422,09-27,Schals,Feiertag für den Schal,https://www.kuriose-feiertage.de/tag-des-schals/,accessibility_new
1423,09-27,Koalas,Feiertag zum Schutz der Koalas,https://www.kuriose-feiertage.de/save-the-koala-day/,pets
1424,09-27,Welttourismustag,Feiertag zur Feier des internationalen Tourismus,https://www.kuriose-feiertage.de/welttourismustag/,explore
1425,09-27,Deutsches Butterbrot,Feiertag für das klassische Butterbrot in Deutschland,https://www.kuriose-feiertage.de/tag-des-deutschen-butterbrots/,local_dining
1426,09-27,Dose Zerdrücken,Feiertag zum Zerdrücken von Dosen in den USA,https://www.kuriose-feiertage.de/zerdruecke-eine-dose-tag/,pan_tool
1427,09-27,Kalter Kakao,Feiertag für kalten Kakao in den USA,https://www.kuriose-feiertage.de/tag-des-kalten-kakao-usa/,local_drink
1428,09-28,Aquarium Revue Nacht,Feiertag für die Fish Tank Floorshow Night in den USA,https://www.kuriose-feiertage.de/aquarium-revue-nacht/,weekend
1429,09-28,Erdbeer Sahne Kuchen,Feiertag für Erdbeer Sahne Kuchen in den USA,https://www.kuriose-feiertage.de/tag-des-erdbeer-sahne-kuchens/,cake
1430,09-28,Geisterjagd,Feiertag für Geisterjagd in den USA,https://www.kuriose-feiertage.de/tag-der-geisterjagd/,ghost
1431,09-28,Recht auf Wissen,Feiertag für das Recht auf Wissen,https://www.kuriose-feiertage.de/international-right-to-know-day/,public
1432,09-28,Pilztag,Feiertag für Pilze in Europa,https://www.kuriose-feiertage.de/europaeischer-pilztag/,eco
1433,09-28,Guter Nachbar,Feiertag für den guten Nachbarn in den USA,https://www.kuriose-feiertage.de/tag-des-guten-nachbarn/,people
1434,09-28,Dumme Fragen,Feiertag für das Stellen von dummen Fragen in den USA,https://www.kuriose-feiertage.de/stell-eine-dumme-frage-tag/,help
1435,09-28,Hasen,Feiertag für den Schutz der Hasen,https://www.kuriose-feiertage.de/international-rabbit-day/,pets
1436,09-29,Michaelstag,Feiertag zur Feier des Michaelstags in Großbritannien,https://www.kuriose-feiertage.de/michaelstag/,celebration
1437,09-29,Biscotti,Feiertag für Biscotti in den USA,https://www.kuriose-feiertage.de/tag-der-biscotti/,cake
1438,09-29,Herztag,Feiertag zur Förderung der Herzgesundheit,https://www.kuriose-feiertage.de/weltherztag-world-heart-day/,favorite
1439,09-30,Olivenöl,Feiertag für extra natives Olivenöl in den USA,https://www.kuriose-feiertage.de/tag-des-olivenoels-extra-vergine/,local_dining
1440,09-30,Podcast,Feiertag für Podcasts weltweit,https://www.kuriose-feiertage.de/internationaler-podcast-tag/,radio
1441,09-30,Hieronymustag,Feiertag für Übersetzer und den Hieronymustag,https://www.kuriose-feiertage.de/hieronymustag-internationaler-uebersetzertag/,translate
1442,09-30,Kaugummi,Feiertag für Kaugummi in den USA,https://www.kuriose-feiertage.de/tag-des-kaugummis/,remove_red_eye
1443,10-01,CD Player,Feiertag für den CD Player in den USA,https://www.kuriose-feiertage.de/tag-des-cd-players/,music_note
1444,10-01,Tag des Kaffees in Deutschland,Feiertag zur Feier des Kaffees in Deutschland,https://www.kuriose-feiertage.de/tag-des-kaffees-in-deutschland/,coffee_maker
1445,10-01,Internationaler Tag des Kaffees,Feiertag zur Feier des Kaffees weltweit,https://www.kuriose-feiertage.de/internationaler-tag-des-kaffees/,coffee_maker
1446,10-01,Weltvegetariertag,Feiertag zur Förderung einer vegetarischen Ernährung,https://www.kuriose-feiertage.de/weltvegetariertag/,eco
1447,10-01,Weltmusiktag,Feiertag zur Feier der Musik weltweit,https://www.kuriose-feiertage.de/weltmusiktag/,music_note
1448,10-02,Tag der Reinigungskräfte,Feiertag zur Anerkennung der Arbeit von Reinigungskräften,https://www.kuriose-feiertage.de/tag-der-reinigungskraefte/,cleaning_services
1449,10-02,Tag des Grünkohls,Feiertag für Grünkohl in den USA,https://www.kuriose-feiertage.de/tag-des-gruenkohls/,eco
1450,10-02,Tag der Kürbiskerne,Feiertag für Kürbiskerne in den USA,https://www.kuriose-feiertage.de/tag-der-kuerbiskerne/,local_dining
1451,10-02,Tag der Phileas Fogg Wette,Feiertag zur Feier der Wette von Phileas Fogg,https://www.kuriose-feiertage.de/tag-der-phileas-fogg-wette/,account_balance
1452,10-02,Auto einen Namen geben,Feiertag zum Geben eines Namens für dein Auto,https://www.kuriose-feiertage.de/gib-deinem-auto-einen-namen-tag/,directions_car
1453,10-02,Tag der Ballonkünstler,Feiertag für Ballonkünstler weltweit,https://www.kuriose-feiertage.de/internationaler-tag-der-ballonkuenstler/,airline_seat_recline_extra
1454,10-03,Smoothie Tag,Feiertag zur Feier des Smoothies,https://www.kuriose-feiertage.de/smoothie-tag/,local_drink
1455,10-03,Tag des Herbstlaubs,Feiertag zum Genießen der Herbstfarben,https://www.kuriose-feiertage.de/tag-der-herbstlaubs/,eco
1456,10-03,Happy Birthday,Feiertag zum Feiern der kuriosen Feiertage,https://www.kuriose-feiertage.de/happy-birthday/,celebration
1457,10-04,Trucker Tag,Feiertag zur Anerkennung der Trucker und ihres Beitrags,https://www.kuriose-feiertage.de/trucker-tag/,directions_bus
1458,10-04,Karo Tag,Feiertag für das Karo-Muster in den USA,https://www.kuriose-feiertage.de/karo-tag/,style
1459,10-04,Flaschenschiffe,Feiertag für das Basteln von Schiffsmodellen in Flaschen,https://www.kuriose-feiertage.de/tag-der-flaschenschiffe/,build
1460,10-04,Zimtschnecke,Feiertag zur Feier der schwedischen Zimtschnecke,https://www.kuriose-feiertage.de/kanelbullens-dag-schweden/,cake
1461,10-04,Tag des Wodkas,Feiertag zur Feier des Wodkas in den USA,https://www.kuriose-feiertage.de/tag-des-wodka/,local_drink
1462,10-04,Welttierschutztag,Feiertag zum Schutz der Tiere weltweit,https://www.kuriose-feiertage.de/welttierschutztag/,pets
1463,10-05,Seifenblasen Tag,Feiertag für Seifenblasen weltweit,https://www.kuriose-feiertage.de/welt-seifenblasen-tag/,bubble_chart
1464,10-05,Weltlehrertag,Feiertag zur Anerkennung von Lehrern weltweit,https://www.kuriose-feiertage.de/weltlehrertag/,school
1465,10-05,Mach etwas Nettes Tag,"Feiertag, um gute Taten zu vollbringen",https://www.kuriose-feiertage.de/mach-etwas-nettes-tag/,heart
1466,10-05,Star Wars Reads Day,Feiertag zum Lesen von Star Wars Büchern,https://www.kuriose-feiertage.de/star-wars-reads-day/,book
1467,10-06,Europäischer Tag der pflegenden Angehörigen,Feiertag zur Anerkennung von pflegenden Angehörigen in Europa,https://www.kuriose-feiertage.de/europaeischer-tag-der-pflegenden-angehoerigen/,favorite
1468,10-06,Tag des Lächelns,Feiertag zur Förderung des Lächelns,https://www.kuriose-feiertage.de/tag-des-laechelns/,sentiment_satisfied
1469,10-06,Nudel Tag,Feiertag zur Feier der Nudel weltweit,https://www.kuriose-feiertage.de/international-noodle-day/,restaurant
1470,10-06,Glühbirnen Austausch Tag,Feiertag zur Förderung des Austauschs von Glühbirnen,https://www.kuriose-feiertage.de/gluehbirnen-austausch-tag/,lightbulb
1471,10-06,Tag des verrückten Hutmachers,Feiertag zur Feier des verrückten Hutmachers,https://www.kuriose-feiertage.de/tag-des-verrueckten-hutmachers/,emoji_objects
1472,10-06,Knoblauch Tag,Feiertag zur Feier des Knoblauchs,https://www.kuriose-feiertage.de/tag-des-knoblauchs/,fastfood
1473,10-06,Deutsch Amerikanischer Tag,Feiertag zur Feier der deutsch-amerikanischen Kultur,https://www.kuriose-feiertage.de/german-american-day/,language
1474,10-07,Tag des Mineralwassers,Feiertag zur Feier des Mineralwassers in Deutschland,https://www.kuriose-feiertage.de/tag-des-mineralwassers/,local_drink
1475,10-07,Tag der amerikanischen Nationalblume,Feiertag zur Feier der Nationalblume der USA,https://www.kuriose-feiertage.de/tag-der-amerikanischen-nationalblume/,eco
1476,10-07,Internationaler Tag der Architektur,Feiertag zur Feier der Architektur weltweit,https://www.kuriose-feiertage.de/world-day-of-architecture/,architecture
1477,10-07,Tag des Morgenmuffels,Feiertag für alle Morgenmuffel in Deutschland,https://www.kuriose-feiertage.de/tag-des-morgenmuffels-in-deutschland/,bedtime
1478,10-07,Tag der Badewanne,Feiertag zur Feier der Badewanne,https://www.kuriose-feiertage.de/tag-der-badewanne/,bathtub
1479,10-08,Obst am Arbeitsplatz Tag,Feiertag zur Förderung von Obst am Arbeitsplatz,https://www.kuriose-feiertage.de/obst-am-arbeitsplatz-tag/,local_dining
1480,10-08,Welttag der Kraken,Feiertag zur Feier der Kraken weltweit,https://www.kuriose-feiertage.de/welttag-der-kraken/,pets
1481,10-08,Tag der Piroggen,Feiertag zur Feier der Piroggen in den USA,https://www.kuriose-feiertage.de/tag-der-piroggen/,local_dining
1482,10-08,Welttag der Buchhandlungen,Feiertag zur Feier der Buchhandlungen weltweit,https://www.kuriose-feiertage.de/world-bookshop-day/,book
1483,10-08,Stell dich deinen Ängsten Tag,"Feiertag, um sich seinen Ängsten zu stellen",https://www.kuriose-feiertage.de/stell-dich-deinen-aengsten-tag/,face
1484,10-08,Tag des Fangspiels,Feiertag für das Fangspiel in den USA,https://www.kuriose-feiertage.de/tag-des-fangspiels/,sports_score
1485,10-08,Wettergesprächs- und Smalltalk-Tag,Feiertag zur Förderung von Wettergesprächen und Smalltalk,https://www.kuriose-feiertage.de/wettergespraechs-und-smalltalk-tag/,chat
1486,10-09,Weltposttag,Feiertag zur Feier des Weltpostvereins und der Postdienste,https://www.kuriose-feiertage.de/weltposttag/,local_shipping
1487,10-09,Hangeul-Tag,Feiertag zur Feier des koreanischen Alphabets,https://www.kuriose-feiertage.de/hangeul-tag/,language
1488,10-09,Tag des Teddybären im Büro,Feiertag zur Feier des Teddybären am Arbeitsplatz,https://www.kuriose-feiertage.de/nimm-deinen-teddybaer-mit-zur-arbeit-tag/,pets
1489,10-09,Schimmelkäse-Tag,Feiertag zur Feier von Schimmelkäse,https://www.kuriose-feiertage.de/schimmelkaese-tag/,local_dining
1490,10-09,Leif-Eriksson-Tag,Feiertag zur Feier von Leif Eriksson,https://www.kuriose-feiertage.de/leif-erikson-day/,explore
1491,10-10,Welttag des Sehens,Feiertag zur Förderung des Bewusstseins für Sehen und Augenpflege,https://www.kuriose-feiertage.de/world-sight-day/,visibility
1492,10-10,Tag der Tic Tacs,Feiertag zur Feier der Tic Tac Bonbons,https://www.kuriose-feiertage.de/tag-der-tic-tacs/,candy
1493,10-10,Tag der Handtasche,Feiertag zur Feier der Handtasche,https://www.kuriose-feiertage.de/tag-der-handtasche/,shopping_bag
1494,10-10,Umarme einen Schlagzeuger-Tag,Feiertag zur Feier von Schlagzeugern,https://www.kuriose-feiertage.de/umarme-einen-schlagzeuger-tag/,music_note
1495,10-10,Tag des Hundes in Deutschland,Feiertag zur Feier des Hundes in Deutschland,https://www.kuriose-feiertage.de/tag-des-hundes/,pets
1496,10-10,Welthundetag,Feiertag zur Feier des Hundes weltweit,https://www.kuriose-feiertage.de/welttag-des-hundes/,pets
1497,10-11,Tag des Schauspiels,Feiertag zur Feier des Schauspiels in Deutschland,https://www.kuriose-feiertage.de/tag-des-schauspiels-in-deutschland/,theaters
1498,10-11,Internationaler Mädchentag,Feiertag zur Förderung der Rechte von Mädchen,https://www.kuriose-feiertage.de/internationaler-maedchentag/,accessible
1499,10-11,Welt-Ei-Tag,Feiertag zur Feier des Eies weltweit,https://www.kuriose-feiertage.de/world-egg-day/,egg
1500,10-11,Tag der Würstchen-Pizza,Feiertag zur Feier der Würstchen-Pizza,https://www.kuriose-feiertage.de/tag-der-wuerstchen-pizza/,local_pizza
1501,10-11,Meine-Party-Tag,Feiertag zur Feier von persönlichen Partys,https://www.kuriose-feiertage.de/its-my-party-day/,celebration
1502,10-11,Fossilien-Tag,Feiertag zur Feier und Anerkennung von Fossilien,https://www.kuriose-feiertage.de/fossilien-tag-in-den-usa-national-fossil-day/,history
1503,10-12,Freidenker-Tag,Feiertag zur Förderung des freien Denkens,https://www.kuriose-feiertage.de/freidenker-tag/,public
1504,10-12,Weltzugvogeltag,Feiertag zur Feier der Zugvögel und ihres Schutzes,https://www.kuriose-feiertage.de/weltzugvogeltag/,nature_people
1505,10-12,Tag des Musikalbums,Feiertag zur Feier des Musikalbums,https://www.kuriose-feiertage.de/national-album-day/,album
1506,10-12,Internationaler Tag der Tape Händler,Feiertag zur Feier der Tape Händler und Kassetten,https://www.kuriose-feiertage.de/international-cassette-store-day/,audiotrack
1507,10-12,Tag der Astronomie,Feiertag zur Feier der Astronomie und des Universums,https://www.kuriose-feiertage.de/astronomy-day/,telescope
1508,10-12,Universaler Tag der Musik,Feiertag zur Feier der universellen Musik,https://www.kuriose-feiertage.de/universaler-tag-der-musik-der-amerikanische-universal-music-day/,music_note
1509,10-12,Internationaler Tag der Frustrationsschreie,Feiertag zur Förderung von Frustrationsbewältigung,https://www.kuriose-feiertage.de/internationaler-tag-der-frustationsschreie/,mood
1510,10-13,M&M Tag,Feiertag zur Feier von M&M-Schokoladen,https://www.kuriose-feiertage.de/mundm-tag/,emoji_food_beverage
1511,10-13,Tag des Gedächtnistrainings,Feiertag zur Förderung von Gehirntraining,https://www.kuriose-feiertage.de/tag-des-gedaechtnistrainings/,memory
1512,10-13,International Suit Up Day,Feiertag zur Feier des Anziehens eines Anzugs,https://www.kuriose-feiertage.de/international-suit-up-day/,checkroom
1513,10-14,Weltnormentag,Feiertag zur Feier der internationalen Standards,https://www.kuriose-feiertage.de/weltnormentag/,trending_up
1514,10-14,Glücklich trotz Glatze Tag,Feiertag zur Förderung des Selbstbewusstseins bei Haarausfall,https://www.kuriose-feiertage.de/gluecklich-trotz-glatze-tag/,face
1515,10-14,Tag des Desserts,Feiertag zur Feier von Desserts,https://www.kuriose-feiertage.de/tag-des-desserts/,cake
1516,10-14,Kolumbus Tag,Feiertag zur Feier von Christoph Kolumbus,https://www.kuriose-feiertage.de/kolumbus-tag/,public
1517,10-15,Tag des Schornsteinfegers,Feiertag zur Feier des Schornsteinfegers,https://www.kuriose-feiertage.de/tag-des-schornsteinfegers/,cleaning_services
1518,10-15,Mops Tag,Feiertag zur Feier der Hunderasse Mops,https://www.kuriose-feiertage.de/mops-tag/,pets
1519,10-15,Tag der Pilze,Feiertag zur Feier von Pilzen,https://www.kuriose-feiertage.de/tag-der-pilze-usa/,nature
1520,10-15,Welttag des Händewaschens,Feiertag zur Förderung des Händewaschens,https://www.kuriose-feiertage.de/welttag-des-haendewaschens/,sanitize
1521,10-16,Tag des Likörs,Feiertag zur Feier von Likören,https://www.kuriose-feiertage.de/tag-des-likoers/,local_drink
1522,10-16,World Bread Day,Feiertag zur Feier von Brot weltweit,https://www.kuriose-feiertage.de/world-bread-day/,bread_slice
1523,10-16,Ex Tag,Feiertag zur Feier des „Ex“-Begriffs,https://www.kuriose-feiertage.de/ex-tag/,sentiment_dissatisfied
1524,10-16,Tag des Wörterbuchs,Feiertag zur Feier des Wörterbuchs und der Sprache,https://www.kuriose-feiertage.de/tag-des-woerterbuchs/,library_books
1525,10-17,Tag der Tabellenkalkulation,Feiertag zur Feier der Tabellenkalkulation und Excel,https://www.kuriose-feiertage.de/tag-der-tabellenkalkulation/,grid_on
1526,10-17,Nationaler Pasta Tag,Feiertag zur Feier der Pasta,https://www.kuriose-feiertage.de/pasta-tag-usa/,ramen
1527,10-17,Trag auffällige Klamotten Tag,Feiertag zur Feier von auffälliger Mode,https://www.kuriose-feiertage.de/trag-auffaellige-klamotten-tag/,style
1528,10-17,Tag der zweiten Chance,Feiertag zur Feier der zweiten Chancen im Leben,https://www.kuriose-feiertage.de/tag-der-zweiten-chance/,cached
1529,10-18,Tag des Kartoffelpürees,Feiertag zur Feier des Kartoffelpürees,https://www.kuriose-feiertage.de/tag-des-kartoffelpuerees/,emoji_food_beverage
1530,10-18,Tag des Schokoladen Cupcakes,Feiertag zur Feier des Schokoladen-Cupcakes,https://www.kuriose-feiertage.de/tag-des-schokoladen-cupcakes/,cake
1531,10-18,Ehrentag des Hackbratens,Feiertag zur Feier des Hackbratens,https://www.kuriose-feiertage.de/ehrentag-des-hackbratens-usa/,local_dining
1532,10-18,Tag der Krawatte in Kroatien,Feiertag zur Feier der Krawatte in Kroatien,https://www.kuriose-feiertage.de/tag-der-krawatte-in-kroatien/,checkroom
1533,10-18,Ohne Bart Tag,Feiertag zur Feier des Bartlosen-Looks,https://www.kuriose-feiertage.de/ohne-bart-tag/,face
1534,10-18,Alaska Day,Feiertag zur Feier des US-amerikanischen Bundesstaates Alaska,https://www.kuriose-feiertage.de/alaska-day/,map
1535,10-19,Internationaler Tag der Reparatur,Feiertag zur Förderung von Reparatur und Nachhaltigkeit,https://www.kuriose-feiertage.de/internationaler-tag-der-reparatur/,build
1536,10-19,Gin Tonic Tag,Feiertag zur Feier des beliebten Cocktails,https://www.kuriose-feiertage.de/gin-tonic-tag/,local_drink
1537,10-19,Internationaler Gib Deinem Fahrrad einen Namen Tag,Feiertag zur Feier der persönlichen Bindung zum Fahrrad,https://www.kuriose-feiertage.de/internationaler-gib-deinem-fahrrad-einen-namen-tag/,pedal_bike
1538,10-19,Der Süßeste Tag in den USA,Feiertag zur Feier des „Süßesten Tages“ und der Liebe,https://www.kuriose-feiertage.de/sweetest-day/,favorite
1539,10-19,Evaluier dein Leben Tag,Feiertag zur Selbstreflexion und Lebensbewertung,https://www.kuriose-feiertage.de/evaluier-dein-leben-tag/,assessment
1540,10-20,Tag der Gehirnerschütterung,Feiertag zur Sensibilisierung für Gehirnerschütterungen,https://www.kuriose-feiertage.de/tag-der-gehirnerschuetterung/,accessibility
1541,10-20,Tag der Allee,Feiertag zur Feier von Alleen in Deutschland,https://www.kuriose-feiertage.de/tag-der-allee/,landscape
1542,10-20,Internationaler Tag der Fluglotsen,Feiertag zur Feier der Arbeit von Fluglotsen,https://www.kuriose-feiertage.de/internationaler-tag-der-fluglotsen/,flight_takeoff
1543,10-20,Tag des Grabsteins,Feiertag zur Reflexion und Feier des Lebens,https://www.kuriose-feiertage.de/tag-des-grabsteins/,location_on
1544,10-20,Internationaler Tag des Faultiers,Feiertag zur Feier der Faultiere und ihres langsamen Lebensstils,https://www.kuriose-feiertage.de/internationaler-tag-des-faultiers/,accessibility_new
1545,10-20,Tag des Shampoos,Feiertag zur Feier von Shampoo und Haarpflege,https://www.kuriose-feiertage.de/tag-des-shampoo-usa/,local_laundry_service
1546,10-20,Internationaler Tag der Köche,Feiertag zur Feier der Arbeit von Köchen weltweit,https://www.kuriose-feiertage.de/internationaler-tag-der-koeche/,restaurant
1547,10-20,Weltosteoporosetag,Feiertag zur Sensibilisierung für Osteoporose,https://www.kuriose-feiertage.de/weltosteoporosetag/,health_and_safety
1548,10-21,Nacho Tag,Feiertag zur Feier des beliebten Snacks Nachos,https://www.kuriose-feiertage.de/nacho-tag/,fastfood
1549,10-21,Tag des Apfels in Großbritannien,Feiertag zur Feier des Apfels,https://www.kuriose-feiertage.de/tag-des-apfels-in-grossbritannien/,eco
1550,10-21,Tag der Kinderseiten in Deutschland,Feiertag zur Feier von kinderfreundlichen Webseiten,https://www.kuriose-feiertage.de/tag-der-kinderseiten-in-deutschland/,child_care
1551,10-21,Zähl Deine Knöpfe Tag,Feiertag zur Feier des Zählens von Knöpfen und Sammlungen,https://www.kuriose-feiertage.de/zaehl-deine-knoepfe-tag/,call_split
1552,10-21,Räum Deinen Desktop auf Tag,Feiertag zur Aufräumaktion des virtuellen Desktops,https://www.kuriose-feiertage.de/raeum-deinen-desktop-auf-tag/,desktop_windows
1553,10-21,Trafalgar Day,Feiertag zur Feier von Admiral Horatio Nelson und der Schlacht von Trafalgar,https://www.kuriose-feiertage.de/trafalgar-day/,flag
1554,10-22,Tag des Wombats,Feiertag zur Feier des australischen Wombats,https://www.kuriose-feiertage.de/tag-des-wombats/,pets
1555,10-22,Tag der Farbe in den Vereinigten Staaten,Feiertag zur Feier der Farben und Farbwahrnehmung,https://www.kuriose-feiertage.de/tag-der-farbe-usa/,palette
1556,10-22,Internationaler Tag der Feststelltaste,Feiertag zur Feier der Feststelltaste auf der Tastatur,https://www.kuriose-feiertage.de/internationaler-tag-der-feststelltaste/,keyboard_capslock
1557,10-22,Tag der Nuss in Großbritannien,Feiertag zur Feier der Nüsse und ihrer Vielfalt,https://www.kuriose-feiertage.de/tag-der-nuss-in-grossbritannien/,emoji_nature
1558,10-22,Tag der Brezel,Feiertag zur Feier der Brezel als Snack,https://www.kuriose-feiertage.de/tag-der-brezel/,local_dining
1559,10-22,Welttag des Stotterns,Feiertag zur Sensibilisierung für das Stottern,https://www.kuriose-feiertage.de/welttag-des-stotterns/,accessibility
1560,10-23,Tag der Crocs,Feiertag zur Feier des bequemen Schuhs Crocs,https://www.kuriose-feiertage.de/tag-der-crocs-usa/,shoes
1561,10-23,Tag des Schneeleoparden,Feiertag zur Feier des Schneeleoparden und des Tierschutzes,https://www.kuriose-feiertage.de/tag-des-schneeleoparden/,animal_hotel
1562,10-23,Gucky Tag,"Feiertag zur Feier von Gucky, dem Mausbiber aus Perry Rhodan",https://www.kuriose-feiertage.de/gucky-tag/,import_contacts
1563,10-23,Tag des Piloten in Brasilien,Feiertag zur Feier der Piloten in Brasilien,https://www.kuriose-feiertage.de/tag-des-piloten-in-brasilien/,flight_takeoff
1564,10-23,Tag des iPod,Feiertag zur Feier des iPod und seiner historischen Bedeutung,https://www.kuriose-feiertage.de/tag-des-ipod/,headset
1565,10-23,Tag des Mols,Feiertag zur Feier des Mols und seiner Bedeutung in der Chemie,https://www.kuriose-feiertage.de/tag-des-mols/,science
1566,10-24,Welttag der Gewürze,Feiertag zur Feier von Gewürzen und ihrer Rolle in der Küche,https://www.kuriose-feiertage.de/welttag-der-gewuerze/,kitchen
1567,10-24,Tag der Fleischwurst,Feiertag zur Feier der Fleischwurst und ihrer kulturellen Bedeutung,https://www.kuriose-feiertage.de/tag-der-fleischwurst/,local_dining
1568,10-24,Tag der Ernährung,Feiertag zur Förderung von gesunder Ernährung und Ernährungskompetenz,https://www.kuriose-feiertage.de/tag-der-ernaehrung-in-den-usa/,restaurant_menu
1569,10-24,Hol Dir Deine Zeit zurück Tag,Feiertag zur Reflexion über das richtige Zeitmanagement,https://www.kuriose-feiertage.de/hol-dir-deine-zeit-zurueck-tag/,access_time
1570,10-24,Tag der Bibliotheken in Deutschland,Feiertag zur Wertschätzung der Bibliotheken und ihrer Rolle in der Gesellschaft,https://www.kuriose-feiertage.de/tag-der-bibliotheken/,library_books
1571,10-25,Tag der Oper,Feiertag zur Feier der Oper und ihrer kulturellen Bedeutung,https://www.kuriose-feiertage.de/tag-der-oper/,theaters
1572,10-25,Welt Lemuren Tag,Feiertag zur Feier der Lemuren und ihrer Bedrohung durch den Lebensraumverlust,https://www.kuriose-feiertage.de/welt-lemuren-tag/,pets
1573,10-25,Welttag der Pizzabäcker,Feiertag zur Feier der Pizzabäcker und ihrer Kunstfertigkeit,https://www.kuriose-feiertage.de/welttag-der-pizzabaecker/,local_pizza
1574,10-25,Internationaler Tag der Künstler,Feiertag zur Feier der Kunst und der kreativen Arbeiten von Künstlern weltweit,https://www.kuriose-feiertage.de/international-artist-day/,palette
1575,10-25,Bandana Tag in Australien,Feiertag zur Feier der Bandana und ihrer Bedeutung in Mode und Kultur,https://www.kuriose-feiertage.de/bandana-tag-in-australien/,face
1576,10-25,Tag des fettigen Essens,"Feiertag zur Feier von fettreichen, aber beliebten Speisen",https://www.kuriose-feiertage.de/tag-des-fettigen-essens-in-den-usa/,fastfood
1577,10-25,Weltpastatag oder Weltnudeltag,Feiertag zur Feier der Pasta und ihrer Vielfalt weltweit,https://www.kuriose-feiertage.de/weltpastatag-oder-weltnudeltag/,local_dining
1578,10-25,Sourest Day,Feiertag zur Feier der sauersten Lebensmittel und Getränke,https://www.kuriose-feiertage.de/sourest-day-sauerster-tag-im-jahr/,sentiment_satisfied_alt
