id,date,name,desc,link,icon
801,05-29,Lerne Kompostieren Tag,Umweltbewusstsein durch Kompostierung fördern,https://www.kuriose-feiertage.de/lerne-kompostieren-tag/,compost
802,05-29,Keks Tag,Feier knuspriger britischer Backtradition,https://www.kuriose-feiertage.de/keks-tag-grossbritannien/,cookie
803,05-29,Tag der Büroklammer,Würdigung eines kleinen Alltagshelden,https://www.kuriose-feiertage.de/tag-der-bueroklammer/,attach_file
804,05-29,Kopfkissen auf den Kühlschrank Tag,Skurriler Brauch für Glück im Haushalt,https://www.kuriose-feiertage.de/leg-dein-kopfkissen-auf-den-kuehlschrank-tag/,bed
805,05-30,Tag des Mint Julep,Feier des erfrischenden Cocktails aus den USA,https://www.kuriose-feiertage.de/tag-des-mint-julep/,local_bar
806,05-30,Nationaltag der Kartoffel,Würdigung der Kartoffel in Peru,https://www.kuriose-feiertage.de/dia-nacional-de-la-papa-peru/,ramen_dining
807,05-30,Ein Loch ist im Eimer Tag,Humorvoller Gedenktag mit Volksliedbezug,https://www.kuriose-feiertage.de/ein-loch-ist-im-eimer-tag/,construction
808,05-30,Gieß eine Blume Tag,Erinnerung an Pflanzenpflege und Natur,https://www.kuriose-feiertage.de/giess-eine-blume-tag/,water_drop
809,05-31,Inchies meets Sketchnotes Tag,Kreativer Tag für kleine Zeichnungen,https://www.kuriose-feiertage.de/inchies-meets-sketchnotes-tag/,brush
810,05-31,World Parrot Day,Würdigung und Schutz der Papageien,https://www.kuriose-feiertage.de/welttag-der-papageien/,emoji_nature
811,05-31,Tag der Makronen,Süße Würdigung französischer Leckereien,https://www.kuriose-feiertage.de/tag-der-makronen/,cake
812,05-31,Weltnichtrauchertag,Globaler Aktionstag zur Tabakprävention,https://www.kuriose-feiertage.de/weltnichtrauchertag/,smoke_free
813,05-31,Tag des Gehörschutzes,Bewusstsein für gesundes Hören,https://www.kuriose-feiertage.de/tag-des-gehoerschutzes/,hearing
814,05-31,Vollständige Sätze Tag,Bewusster Sprachgebrauch im Alltag,https://www.kuriose-feiertage.de/artikuliere-vollstaendige-saetze-tag/,record_voice_over
815,06-01,Tag der Organspende,Wichtiger Gesundheitstag zur Organspende,https://www.kuriose-feiertage.de/tag-der-organspende/,volunteer_activism
816,06-01,Welttag der Riffe,Schutz und Bewusstsein für Korallenriffe,https://www.kuriose-feiertage.de/world-reef-day/,waves
817,06-01,Oscar the Grouch Day,Geburtstag des kultigen Charakters aus der Sesamstraße,https://www.kuriose-feiertage.de/oscar-the-grouch-day/,sentiment_dissatisfied
818,06-01,Tag des Nagellacks,Würdigung farbenfroher Nagelpflege,https://www.kuriose-feiertage.de/tag-des-nagellacks/,color_lens
819,06-01,Tag der Olive,Würdigung der Olive in Küche und Kultur,https://www.kuriose-feiertage.de/tag-der-olive/,restaurant
820,06-01,Sag etwas Nettes Tag,Tag für freundliche Worte und Komplimente,https://www.kuriose-feiertage.de/sag-etwas-nettes-tag/,emoji_emotions
821,06-01,Internationaler Kindertag,Weltweiter Ehrentag für Kinderrechte,https://www.kuriose-feiertage.de/internationaler-kindertag/,child_care
822,06-01,Weltmilchtag,Aktionstag rund um das Thema Milch,https://www.kuriose-feiertage.de/weltmilchtag/,local_drink
823,06-02,Tag der Grillhähnchen,Feier des klassischen Grillgerichts,https://www.kuriose-feiertage.de/tag-der-grillhaehnchen/,restaurant_menu
824,06-02,Tag des Modellflugs,Aktionstag für Modellflugbegeisterte,https://www.kuriose-feiertage.de/tag-des-modellflugs/,airplanemode_active
825,06-02,Yell Fudge at the Cobras Day,Skurriler US-Feiertag mit absurdem Namen,https://www.kuriose-feiertage.de/yell-fudge-at-the-cobras-in-north-america-day/,emoji_people
826,06-02,Sjómannadagurinn,Ehrentag für Seeleute und Fischer in Island,https://www.kuriose-feiertage.de/sjomannadagurinn/,sailing
827,06-02,Welt Naturisten Tag,Internationaler Tag der Freikörperkultur,https://www.kuriose-feiertage.de/welt-naturisten-tag/,self_improvement
828,06-03,Welt Apfelwein Tag,Würdigung des Ciders weltweit,https://www.kuriose-feiertage.de/welt-apfelwein-tag/,wine_bar
829,06-03,Tag der Amsel,Bundesweiter Aktionstag rund um die Amsel,https://www.kuriose-feiertage.de/tag-der-amsel/,park
830,06-03,Thank God It’s Monday Day,US-Feiertag mit positivem Wochenstart,https://www.kuriose-feiertage.de/gott-sei-dank-ist-montag-tag/,calendar_today
831,06-03,Tag der Eier,US-Feiertag zu Ehren des Frühstücksklassikers,https://www.kuriose-feiertage.de/national-egg-day-usa/,egg
832,06-03,Tag der Wiederholungen,Spaßiger Feiertag zur Wiederholung von Dingen,https://www.kuriose-feiertage.de/tag-der-wiederholungen/,repeat
833,06-03,Früher Feierabend Tag,Tag zum pünktlichen oder frühen Feierabend,https://www.kuriose-feiertage.de/mach-frueher-feierabend-tag/,logout
834,06-03,Weltfahrradtag,Internationaler Aktionstag rund ums Radfahren,https://www.kuriose-feiertage.de/europaischer-tag-des-fahrrads/,directions_bike
835,06-04,Tag des Cognacs,Würdigung des französischen Weinbrands,https://www.kuriose-feiertage.de/tag-des-cognacs/,liquor
836,06-04,Tag des Einkaufswagens,Hommage an ein alltägliches Shopping-Tool,https://www.kuriose-feiertage.de/tag-des-einkaufswagens/,shopping_cart
837,06-04,Tag des Käses,Würdigung von Käse in allen Varianten,https://www.kuriose-feiertage.de/tag-des-kaese-usa/,lunch_dining
838,06-04,Tag der Schneider,Würdigung des Schneiderhandwerks,https://www.kuriose-feiertage.de/tag-der-schneider/,cut
839,06-04,Umarme Deine Katze Tag,Ein Tag für Katzenfreunde und Schmusetiger,https://www.kuriose-feiertage.de/umarme-deine-katze-tag/,pets
840,06-05,Tag des Lebkuchens,Süßer Feiertag zu Ehren des Lebkuchens,https://www.kuriose-feiertage.de/tag-des-lebkuchens/,cookie
841,06-05,Ketchup Tag,Feiertag rund um die beliebte Tomatensauce,https://www.kuriose-feiertage.de/ketchup-tag/,restaurant
842,06-05,Welttag des Laufens,Globaler Aktionstag zur Bewegung,https://www.kuriose-feiertage.de/global-running-day/,directions_run
843,06-05,Weltumwelttag,UNO-Aktionstag zum Schutz der Umwelt,https://www.kuriose-feiertage.de/weltumwelttag/,eco
844,06-05,Tag der Haltung,US-Aktionstag für positives Auftreten,https://www.kuriose-feiertage.de/tag-der-haltung/,psychology
845,06-05,Tag des Heißluftballons,US-Feiertag rund um das Heißluftballonfahren,https://www.kuriose-feiertage.de/tag-des-heissluftballons/,travel
846,06-06,Internationaler Slayer Tag,Aktionstag zu Ehren der Metalband Slayer,https://www.kuriose-feiertage.de/internationaler-slayer-tag/,music_note
847,06-06,Tag der Höhlen und unterirdischen Welten,Internationaler Aktionstag zur Erforschung und Wertschätzung von Höhlen,https://www.kuriose-feiertage.de/internationaler-hoehlentag/,terrain
848,06-06,Tag der russischen Sprache,UNO-Aktionstag zur Förderung der russischen Sprache,https://www.kuriose-feiertage.de/internationaler-tag-der-russischen-sprache/,language
849,06-06,Tag der Gartenarbeit,US-Aktionstag zur Bewegung im Garten,https://www.kuriose-feiertage.de/tag-der-gartenarbeit/,yard
850,06-06,Tag des Jo-Jos,US-Feiertag zur Feier des klassischen Spielzeugs,https://www.kuriose-feiertage.de/tag-des-jo-jo/,toys
851,06-07,Tag der Apotheke,Anerkennungstag für Apotheken und Pharmazeut*innen in Deutschland,https://www.kuriose-feiertage.de/tag-der-apotheke-deutschland/,local_pharmacy
852,06-07,Tag des Donuts,US-Feiertag rund um das beliebte Gebäck,https://www.kuriose-feiertage.de/tag-des-doughnut-usa/,donut_small
853,06-07,Schokoladeneis Tag,US-Feiertag für Liebhaber von Schokoladeneis,https://www.kuriose-feiertage.de/schokoladeneis-tag/,icecream
854,06-07,Tag des Videorecorders,US-Feiertag für das Kultgerät der 80er und 90er,https://www.kuriose-feiertage.de/tag-des-videorekorders/,videocam
855,06-08,Tag der Libelle,US-Naturtag zu Ehren der Libellen,https://www.kuriose-feiertage.de/tag-der-libelle/,bug_report
856,06-08,Tag des Berliners,US-Feiertag für mit Marmelade oder Creme gefüllte Donuts,https://www.kuriose-feiertage.de/tag-des-berliners/,cake
857,06-08,Ghostbusters Day,Gedenktag zum Kinostart der Ghostbusters,https://www.kuriose-feiertage.de/ghostbusters-day/,movie
858,06-08,Tag des Roséweins,US-Feiertag zu Ehren des Roséweins,https://www.kuriose-feiertage.de/tag-des-roseweins/,wine_bar
859,06-08,Welttag des Gins,Internationaler Tag zur Feier des Gins,https://www.kuriose-feiertage.de/welttag-des-gin-world-gin-day/,local_bar
860,06-08,Beste Freunde Tag,Feiertag zur Wertschätzung echter Freundschaften,https://www.kuriose-feiertage.de/beste-freunde-tag/,group
861,06-08,Hoppla Tag,Lustiger US-Feiertag zum Lächeln und Positivsein,https://www.kuriose-feiertage.de/hoppla-tag/,sentiment_satisfied
862,06-08,Was willst Du trinken Tag?,Kurioser US-Feiertag zum Thema Getränkewahl,https://www.kuriose-feiertage.de/name-your-poison-day/,local_drink
863,06-08,Tag des Meeres,UNO-Aktionstag für den Schutz der Weltmeere,https://www.kuriose-feiertage.de/tag-des-meeres/,waves
864,06-09,Tag der keltischen Kunst,Internationaler Tag zur Feier keltischer Kunst,https://www.kuriose-feiertage.de/tag-der-keltischen-kunst/,brush
865,06-09,Tag der Archive,Internationaler Aktionstag zum Thema Archive,https://www.kuriose-feiertage.de/internationaler-tag-der-archive/,inventory_2
866,06-09,Tag des Gartens,Bundesweiter Aktionstag zur Gartenkultur in Deutschland,https://www.kuriose-feiertage.de/tag-des-gartens-in-deutschland/,yard
867,06-09,Tag des Erdbeer-Rhabarber-Kuchens,US-Feiertag für das beliebte Sommergebäck,https://www.kuriose-feiertage.de/erdbeer-rhabarber-kuchen-tag/,bakery_dining
868,06-09,Donald Ducks Geburtstag,Gedenktag zur ersten Filmvorführung der Comicfigur,https://www.kuriose-feiertage.de/happy-birthday-donald-duck/,duck
869,06-10,Tag der Heraldik,Internationaler Tag zur Feier heraldischer Symbole,https://www.kuriose-feiertage.de/internationaler-tag-der-heraldik/,shield
870,06-10,Weltjugendstiltag,Internationaler Tag zur Feier des Jugendstils,https://www.kuriose-feiertage.de/weltjugendstiltag/,palette
871,06-10,Tag des Kugelschreibers,US-Feiertag für das beliebte Schreibgerät,https://www.kuriose-feiertage.de/tag-des-kugelschreibers/,edit
872,06-10,Eistee Tag,US-Feiertag für das beliebte Sommergetränk,https://www.kuriose-feiertage.de/eistee-tag/,emoji_food_beverage
873,06-11,Tag der Geodäsie,Aktions- und Informationstag zur Vermessung der Erde,https://www.kuriose-feiertage.de/tag-der-geodaesie-in-deutschland/,language
874,06-11,Tag der Pizza Margherita,US-Feiertag für die klassische italienische Pizza,https://www.kuriose-feiertage.de/tag-der-pizza-margherita/,local_pizza
875,06-11,Cousteau Day,Gedenktag zu Ehren von Jacques Cousteau,https://www.kuriose-feiertage.de/cousteau-day/,scuba_diving
876,06-11,Kamehameha Tag,Hawaiianischer Feiertag zu Ehren von König Kamehameha I.,https://www.kuriose-feiertage.de/kamehameha-day/,flag
877,06-11,Tag des Maiskolbens,US-Feiertag für gegrillte Maiskolben,https://www.kuriose-feiertage.de/tag-des-maiskolbens/,restaurant
878,06-11,Tag des German Schokoladenkuchens,US-Feiertag für den beliebten Schokoladenkuchen,https://www.kuriose-feiertage.de/national-german-chocolate-cake-day/,cake
879,06-12,Superman Tag,Aktions- und Fanevent rund um den Comic-Helden,https://www.kuriose-feiertage.de/superman-tag/,bolt
880,06-12,Dia dos Namorados,Brasilianischer Feiertag für Verliebte,https://www.kuriose-feiertage.de/dia-dos-namorados/,favorite
881,06-12,Falafel Tag,Internationaler Feiertag für das vegetarische Streetfood,https://www.kuriose-feiertage.de/international-falafel-day/,ramen_dining
882,06-12,Tag der Erdnussbutter-Kekse,US-Feiertag für süße Naschkatzen,https://www.kuriose-feiertage.de/tag-der-erdnussbutter-kekse/,cookie
883,06-12,Loving Tag,US-Gedenktag zur historischen Bürgerrechtsentscheidung,https://www.kuriose-feiertage.de/national-loving-day-usa/,diversity_1
884,06-12,Tag der roten Rose,Feiertag zur Würdigung der roten Rose,https://www.kuriose-feiertage.de/tag-der-roten-rose/,local_florist
885,06-12,Tag des Tagebuchs,Feiertag zur Wertschätzung des Tagebuchschreibens,https://www.kuriose-feiertage.de/tag-des-tagebuchs/,import_contacts
886,06-13,Tag der Tauben,Gedenktag zu Ehren der Taube,https://www.kuriose-feiertage.de/tag-der-tauben/,pets
887,06-13,Tag der verhinderten Köche,Feiertag für die weniger geschickten Köche,https://www.kuriose-feiertage.de/tag-der-verhinderten-koeche/,restaurant
888,06-13,Internationaler Tag des Axtwerfens,Feiertag für das Axtwerfen als Sportart,https://www.kuriose-feiertage.de/international-axe-throwing-day/,sports_handball
889,06-13,Jäte deinen Garten Tag,Gedenktag zur Gartenarbeit und Unkrautentfernung,https://www.kuriose-feiertage.de/jaete-deinen-garten-tag/,eco
890,06-13,Tag der Nähmaschine,Feiertag zu Ehren der Nähmaschine,https://www.kuriose-feiertage.de/tag-der-naehmaschine/,laptop_chromebook
891,06-14,Internationaler Bade Tag,Feiertag zur Feier des Bades,https://www.kuriose-feiertage.de/international-bath-day/,bathtub
892,06-14,Tag des Erdbeertörtchens,Feiertag zu Ehren des Erdbeertörtchens,https://www.kuriose-feiertage.de/tag-des-erdbeertoertchens/,cake
893,06-14,Tag des Bourbons,Feiertag für das beliebte Getränk,https://www.kuriose-feiertage.de/tag-des-bourbon/,local_bar
894,06-14,Weltblutspendetag,Internationaler Tag zur Förderung der Blutspende,https://www.kuriose-feiertage.de/weltblutspendetag/,local_hospital
895,06-15,Küss einen Wookiee Tag,Feiertag zur Feier der Wookiees aus Star Wars,https://www.kuriose-feiertage.de/national-kiss-a-wookiee-day/,favorite
896,06-15,Tag des Jonglierens,Feiertag für das Jonglieren und die Kunstfertigkeit,https://www.kuriose-feiertage.de/tag-des-jonglierens/,sports_baseball
897,06-15,Tag des Strandkorbs,Feiertag zur Feier des Strandkorbs in Deutschland,https://www.kuriose-feiertage.de/tag-des-strandkorbs-in-deutschland/,beach_access
898,06-15,International Surfing Day,Feiertag zur Feier des Surfens weltweit,https://www.kuriose-feiertage.de/international-surfing-day/,surfing
899,06-15,Macht des Lächelns Tag,Feiertag zur Förderung der positiven Energie durch Lächeln,https://www.kuriose-feiertage.de/macht-des-laechelns-tag/,mood
900,06-15,Tag der Naturfotografie,Feiertag zur Förderung der Naturfotografie,https://www.kuriose-feiertage.de/tag-der-naturfotografie/,photo_camera
901,06-15,Global Wind Day,Feiertag zur Sensibilisierung für Windenergie und -nutzung,https://www.kuriose-feiertage.de/global-wind-day/,cloud_queue
902,06-16,Internationaler Tag des Wasserfalls,Feiertag zur Würdigung von Wasserfällen,https://www.kuriose-feiertage.de/international-waterfall-day/,waterfall
903,06-16,Internationaler Tag der Meeresschildkröten,Feiertag zur Schutzförderung von Meeresschildkröten,https://www.kuriose-feiertage.de/internationaler-tag-der-meeresschildkroeten/,turtle
904,06-16,Tag der Cannoli,Feiertag für das italienische Gebäck Cannoli,https://www.kuriose-feiertage.de/tag-der-cannoli/,cake
905,06-16,Tag des frischen Gemüses,Feiertag zur Förderung von frischem Gemüse,https://www.kuriose-feiertage.de/tag-des-frischen-gemuese/,eco
906,06-16,Captain Picard Tag,Feiertag zu Ehren von Captain Picard aus Star Trek,https://www.kuriose-feiertage.de/captain-picard-day/,star
907,06-16,Bloomsday in Irland,Literarischer Feiertag zu Ehren von James Joyce' "Ulysses",https://www.kuriose-feiertage.de/bloomsday/,book
908,06-17,Nimm Deine Katze mit zur Arbeit Tag,Feiertag zum Mitnehmen der Katze ins Büro,https://www.kuriose-feiertage.de/take-your-cat-to-work-day/,pets
909,06-17,Welttag der Krokodile,Feiertag zu Ehren der Krokodile,https://www.kuriose-feiertage.de/welttag-der-krokodile/,pets
910,06-17,Internationaler Tag der Müllabfuhr,Feiertag zur Würdigung der Müllabfuhr,https://www.kuriose-feiertage.de/internationaler-tag-der-muellabfuhr/,recycling
911,06-17,Iss Dein Gemüse Tag,Feiertag zum Essen von mehr Gemüse,https://www.kuriose-feiertage.de/iss-dein-gemuese-tag/,eco
912,06-17,Tag des Apfelstrudels,Feiertag für das beliebte Apfelstrudel-Dessert,https://www.kuriose-feiertage.de/tag-des-apfelstrudels/,cake
913,06-18,Geh Angeln Tag,Feiertag für das Angeln als Freizeitbeschäftigung,https://www.kuriose-feiertage.de/geh-angeln-tag/,fishing
914,06-18,Internationaler Tag des Picknicks,Feiertag zur Feier des Picknicks,https://www.kuriose-feiertage.de/international-picnic-day/,local_dining
915,06-18,Internationaler Sushi Tag,Feiertag zu Ehren von Sushi,https://www.kuriose-feiertage.de/international-sushi-day/,restaurant
916,06-18,Gönn Dir was Tag,Feiertag zum Ausgeben und sich etwas zu gönnen,https://www.kuriose-feiertage.de/goenn-dir-was-tag/,star
917,06-18,Internationaler Panik Tag,Feiertag zum Thema Panik und Gelassenheit,https://www.kuriose-feiertage.de/international-panic-day/,mood
918,06-19,Garfield Tag,"Feiertag zu Ehren von Garfield, der Comicfigur",https://www.kuriose-feiertage.de/garfield-tag/,pets
919,06-19,Tag der Armbanduhr,Feiertag zur Feier der Armbanduhr,https://www.kuriose-feiertage.de/tag-der-armbanduhr/,watch
920,06-19,Iss einen Oreo Keks Tag,Feiertag für das berühmte Oreo Keks,https://www.kuriose-feiertage.de/iss-einen-oreo-keks-tag/,cake
921,06-19,Weltbummeltag,Feiertag zum gemütlichen Bummeln,https://www.kuriose-feiertage.de/world-sauntering-day/,directions_walk
922,06-19,Martini Tag,Feiertag für den Martini-Cocktail,https://www.kuriose-feiertage.de/martini-tag/,local_bar
923,06-20,Welttag der Dackel,Feiertag zu Ehren des Dackels,https://www.kuriose-feiertage.de/welttag-der-dackel/,pets
924,06-20,Sommersonnenwende,Feiertag für den längsten Tag des Jahres,https://www.kuriose-feiertage.de/sommersonnenwende/,wb_sunny
925,06-20,Muschel Tag,Feiertag zu Ehren von Muscheln,https://www.kuriose-feiertage.de/muschel-tag/,beach_access
926,06-20,Tag der Filtertüte,Feiertag zu Ehren von Melitta Bentz und der Filtertüte,https://www.kuriose-feiertage.de/tag-der-filtertuete/,local_cafe
927,06-20,Welttag der Produktivität,Internationaler Tag der Produktivität,https://www.kuriose-feiertage.de/world-productivity-day/,assessment
928,06-20,Tag des Vanille Milchshakes,Feiertag für den Vanille-Milchshake,https://www.kuriose-feiertage.de/tag-des-vanille-milchshakes/,icecream
929,06-21,Mofa Tag in Deutschland,Feiertag zu Ehren des Mofas,https://www.kuriose-feiertage.de/mofa-tag-in-deutschland/,directions_bike
930,06-21,Geh Skateboarden Tag,Feiertag zum Skateboarden,https://www.kuriose-feiertage.de/geh-skateboarden-tag/,directions_run
931,06-21,Welttag der Giraffe,Feiertag zu Ehren der Giraffe,https://www.kuriose-feiertage.de/welttag-der-giraffe/,pets
932,06-21,Nimm Deinen Hund mit zur Arbeit Tag,Feiertag zum Mitnehmen des Hundes ins Büro,https://www.kuriose-feiertage.de/take-your-dog-to-work-day-usa/,pets
933,06-21,Tag der Flip Flops,Feiertag für die Flip Flops,https://www.kuriose-feiertage.de/national-flip-flop-day-usa/,flip_to_front
934,06-21,Tag der Musik in Deutschland,Feiertag zur Feier der Musik,https://www.kuriose-feiertage.de/tag-der-musik-in-deutschland/,music_note
935,06-21,Selfie Tag,Feiertag für das Selfie,https://www.kuriose-feiertage.de/selfie-tag/,camera_alt
936,06-21,Internationaler Tag des Yoga,Feiertag für Yoga,https://www.kuriose-feiertage.de/international-yoga-day/,fitness_center
937,06-21,Internationaler T Shirt Tag,Feiertag für das T-Shirt,https://www.kuriose-feiertage.de/international-tshirt-day/,tshirt
938,06-21,Tag des Schlafes in Deutschland,Feiertag zum Thema Schlaf,https://www.kuriose-feiertage.de/tag-des-schlafes/,bedtime
939,06-22,Welttag der Kamele,Feiertag zu Ehren der Kamele,https://www.kuriose-feiertage.de/welttag-der-kamele/,directions_car
940,06-22,Weltregenwaldtag,Feiertag für den Regenwald,https://www.kuriose-feiertage.de/weltregenwaldtag/,eco
941,06-22,Welttag des VW Käfers,Feiertag für den VW Käfer,https://www.kuriose-feiertage.de/welttag-des-vw-kaefers/,directions_car
942,06-22,Internationaler Tag der Schlümpfe,Feiertag zu Ehren der Schlümpfe,https://www.kuriose-feiertage.de/internationaler-tag-der-schluempfe/,face
943,06-22,Tag der Zwiebelringe,Feiertag für Zwiebelringe,https://www.kuriose-feiertage.de/tag-der-zwiebelringe/,fastfood
944,06-22,Schokoladen Eclair Tag,Feiertag für das Schokoladen-Eclair,https://www.kuriose-feiertage.de/schokoladen-eclair-tag/,cake
945,06-22,Typisch Mann Tag,Feiertag für die "typischen" Männerdinge,https://www.kuriose-feiertage.de/stupid-guy-thing-day/,guy
946,06-23,Tag der pinken Flamingos,Feiertag zu Ehren der Flamingos,https://www.kuriose-feiertage.de/tag-der-pinken-flamingos/,flame
947,06-23,Loslassen Tag,Feiertag zum Thema Loslassen,https://www.kuriose-feiertage.de/loslassen-tag/,airline_seat_recline_normal
948,06-23,Pink Tag,Feiertag für die Farbe Pink,https://www.kuriose-feiertage.de/pink-tag/,color_lens
949,06-23,Tag der Schreibmaschine,Feiertag zu Ehren der Schreibmaschine,https://www.kuriose-feiertage.de/typewriter-day/,keyboard
950,06-24,Johannistag,Feiertag zur Feier von Johannistag und Johannisnacht,https://www.kuriose-feiertage.de/johannistag/,celebration
951,06-24,Schwimm eine Runde Tag,Feiertag für das Schwimmen,https://www.kuriose-feiertage.de/schwimm-eine-runde-tag/,pool
952,06-24,Internationaler Feen Tag,Feiertag zu Ehren der Feen,https://www.kuriose-feiertage.de/international-fairy-day/,star
953,06-24,Tag der Pralinen,Feiertag für Pralinen,https://www.kuriose-feiertage.de/tag-der-pralinen-usa/,local_cafe
954,06-24,Tag des UFOs,Feiertag für UFOs,https://www.kuriose-feiertage.de/tag-des-ufos/,flight
955,06-25,Tag des Ziegenkäses,Feiertag für Ziegenkäse,https://www.kuriose-feiertage.de/tag-des-ziegenkaeses/,local_dining
956,06-25,Welttag der Schulfreunde,Feiertag zu Ehren der Schulfreunde,https://www.kuriose-feiertage.de/welttag-der-schulfreunde/,group
957,06-25,Tag des Erdbeerparfaits,Feiertag für Erdbeerparfaits,https://www.kuriose-feiertage.de/tag-des-erdbeerparfaits/,cake
958,06-25,Noch sechs Monate bis Weihnachten,Feiertag zum Zählen der verbleibenden Monate bis Weihnachten,https://www.kuriose-feiertage.de/leon-day/,calendar_today
959,06-25,Tag der Seefahrer,Feiertag für die Seefahrer,https://www.kuriose-feiertage.de/day-of-the-seafarer/,directions_boat
960,06-25,Blockhaus Tag,Feiertag für Blockhäuser,https://www.kuriose-feiertage.de/blockhaus-tag/,home
961,06-26,Welttag der Kältetechnik,Feiertag für Kältetechnologie,https://www.kuriose-feiertage.de/welttag-der-kaeltetechnik/,ac_unit
962,06-26,Tag der Tropicals,Feiertag für tropische Cocktails,https://www.kuriose-feiertage.de/tag-der-tropicals/,cocktail
963,06-26,Tag des Kanus,Feiertag für Kanus,https://www.kuriose-feiertage.de/tag-des-kanus-kanada/,directions_boat
964,06-26,Bärengedenktag,Feiertag zum Gedenken an Bären,https://www.kuriose-feiertage.de/baerengedenktag-in-deutschland/,pets
965,06-26,Tag des Schokoladenpuddings,Feiertag für Schokoladenpudding,https://www.kuriose-feiertage.de/tag-des-schokoladenpuddings/,cake
966,06-27,Tag der Zwiebel,Feiertag für Zwiebeln,https://www.kuriose-feiertage.de/tag-der-zwiebel/,restaurant
967,06-27,Siebenschläfertag,Feiertag zu Ehren der sieben Schläfer von Ephesus,https://www.kuriose-feiertage.de/siebenschlaefertag/,schedule
968,06-27,Tag des Handschlags,Feiertag für den Handschlag,https://www.kuriose-feiertage.de/tag-des-handschlags/,handshake
969,06-27,Internationaler Tag der Ananas,Feiertag für die Ananas,https://www.kuriose-feiertage.de/international-pineapple-day/,local_dining
970,06-27,Happy Birthday to You Tag,Feiertag zum Feiern von Geburtstagen,https://www.kuriose-feiertage.de/happy-birthday-to-you-tag/,celebration
971,06-27,Tag der Sonnenbrille,Feiertag für Sonnenbrillen,https://www.kuriose-feiertage.de/tag-der-sonnenbrille/,remove_red_eye
972,06-28,Tag der Foodtrucks,Feiertag für Foodtrucks,https://www.kuriose-feiertage.de/tag-der-foodtrucks/,local_dining
973,06-28,Internationaler Tag des Body Piercing,Feiertag für Body Piercing,https://www.kuriose-feiertage.de/international-body-piercing-day/,accessibility_new
974,06-28,Tag der alternativen Kreiszahl Tau,Feiertag für die Zahl Tau,https://www.kuriose-feiertage.de/tau-day/,math_operations
975,06-28,Internationaler Tag der Feststelltaste,Feiertag für die Feststelltaste,https://www.kuriose-feiertage.de/internationaler-tag-der-feststelltaste/,keyboard_capslock
976,06-28,Paul Bunyan Tag,Feiertag zu Ehren von Paul Bunyan,https://www.kuriose-feiertage.de/paul-bunyan-day/,face
977,06-29,Tag des Deutschen Whiskys,Feiertag für deutschen Whisky,https://www.kuriose-feiertage.de/tag-des-deutschen-whiskys/,local_bar
978,06-29,Internationaler Tag der Tropen,Feiertag zu Ehren der Tropen,https://www.kuriose-feiertage.de/internationaler-tag-der-tropen/,nature
979,06-29,Internationaler Matsch Tag,Feiertag für Matsch,https://www.kuriose-feiertage.de/international-mud-day/,terrain
980,06-29,Tag des Mandel Buttercrunch,Feiertag für Mandel Buttercrunch,https://www.kuriose-feiertage.de/tag-des-mandel-buttercrunch/,local_dining
981,06-29,Tag des Waffeleisens,Feiertag für das Waffeleisen,https://www.kuriose-feiertage.de/tag-des-waffeleisens/,kitchen
982,06-29,Tag der Kamera,Feiertag zu Ehren der Kamera,https://www.kuriose-feiertage.de/tag-der-kamera/,camera
983,06-30,Internationaler Tag der Asteroiden,Feiertag zu Ehren der Asteroiden,https://www.kuriose-feiertage.de/internationaler-tag-der-asteroiden/,asterisk
984,06-30,Mai Tai Tag,Feiertag für den Mai Tai Cocktail,https://www.kuriose-feiertage.de/mai-tai-tag/,local_bar
985,06-30,Tag des Meteors,Gedenken an das Tunguska Ereignis,https://www.kuriose-feiertage.de/tag-des-meteors/,explore
986,07-01,Chicken Wing Tag,Feiertag für Chicken Wings,https://www.kuriose-feiertage.de/chicken-wing-tag/,restaurant
987,07-01,Tag der Litfaßsäule,Erinnerung an die erste Litfaßsäule,https://www.kuriose-feiertage.de/tag-der-litfasssaeule/,map
988,07-01,Tag der Briefmarken,Gedenken an die Briefmarken,https://www.kuriose-feiertage.de/tag-der-briefmarken/,mail
989,07-01,Tag der kreativen Eissorten,Feiertag für kreative Eissorten,https://www.kuriose-feiertage.de/tag-der-kreativen-eissorten/,icecream
