id,date,name,desc,link,icon
391,03-14,Tag der Zahl Pi,Pi Day,https://www.kuriose-feiertage.de/pi-day-der-tag-der-zahl-pi/,calculate
392,03-15,Tag der Druckkunst,Bundesweiter Kunsttag in Deutschland,https://www.kuriose-feiertage.de/tag-der-druckkunst/,palette
393,03-15,Brutus Tag,Iden des März & Brutus Day,https://www.kuriose-feiertage.de/brutus-tag-die-iden-des-maerz/,gavel
394,03-15,Tag der Rückengesundheit,Gesundheitstag in Deutschland,https://www.kuriose-feiertage.de/tag-der-rueckengesundheit/,accessibility_new
395,03-15,Welttag des Schlafes,World Sleep Day,https://www.kuriose-feiertage.de/world-sleep-day/,bed
396,03-15,Sprachlos Tag,Dumbstruck Day in den USA,https://www.kuriose-feiertage.de/sprachlos-tag/,record_voice_over
397,03-15,Alles ist falsch Tag,Everything You Think is Wrong Day in den USA,https://www.kuriose-feiertage.de/alles-was-du-denkst-ist-falsch-tag/,psychology
398,03-15,Weltverbrauchertag,World Consumer Rights Day,https://www.kuriose-feiertage.de/weltverbrauchertag/,shopping_cart
399,03-16,Tag des Reisfladens,Kulinarischer Feiertag in Belgien und Deutschland,https://www.kuriose-feiertage.de/tag-des-reisfladens/,bakery_dining
400,03-16,Tag der Bücherschmuggler,Buchträger-Feiertag in Litauen,https://www.kuriose-feiertage.de/tag-der-buecherschmuggler-in-litauen/,menu_book
401,03-16,Tag der Artischockenherzen,Artichoke Hearts Day in den USA,https://www.kuriose-feiertage.de/tag-der-artischockenherzen/,restaurant
402,03-16,Tag des Pandas,National Panda Day in den USA,https://www.kuriose-feiertage.de/tag-des-pandas/,pets
403,03-16,Ehrentag der Lippen,Lips Appreciation Day in den USA,https://www.kuriose-feiertage.de/ehrentag-der-lippen/,face
404,03-16,Alles ist richtig Tag,Everything You Do Is Right Day in den USA,https://www.kuriose-feiertage.de/alles-was-du-machst-ist-richtig-tag/,thumb_up
405,03-16,Indiebookday,Aktionstag für unabhängige Verlage in D/A/CH,https://www.kuriose-feiertage.de/indiebookday/,menu_book
406,03-16,Tag des Schluckaufs,Hiccup Day in den USA,https://www.kuriose-feiertage.de/tag-des-schluckaufs/,sick
407,03-17,Tag des Tauchboots,Submarine Day in Großbritannien,https://www.kuriose-feiertage.de/tag-des-tauchboots/,directions_boat
408,03-17,St. Patrick's Day,Irischer Nationalfeiertag zu Ehren des Heiligen Patrick,https://www.kuriose-feiertage.de/st-patricks-day/,celebration
409,03-18,Welt Recycling Tag,Global Recycling Day,https://www.kuriose-feiertage.de/welt-recycling-tag/,recycling
410,03-18,Tag der Fruchtbarkeitsgöttin,Goddess of Fertility Day in den USA,https://www.kuriose-feiertage.de/tag-der-fruchtbarkeitsgoettin/,spa
411,03-18,Tag des Sloppy Joe,Sloppy Joe Day in den USA,https://www.kuriose-feiertage.de/tag-des-sloppy-joe/,lunch_dining
412,03-18,Tag der peinlichen Momente,Awkward Moments Day in den USA,https://www.kuriose-feiertage.de/tag-der-peinlichen-momente/,sentiment_very_dissatisfied
413,03-19,Tag der Luftretter,Ehrentag für Luftrettung in Deutschland,https://www.kuriose-feiertage.de/tag-der-luftretter/,helicopter
414,03-19,Tag des Geflügels,Poultry Day in den USA,https://www.kuriose-feiertage.de/tag-des-gefluegels/,egg
415,03-19,Schokoladen-Karamell-Tag,Chocolate Caramel Day in den USA,https://www.kuriose-feiertage.de/schokoladen-karamell-tag/,icecream
416,03-19,Frühstück am Arbeitsplatz Tag,Deskfast Day in den USA,https://www.kuriose-feiertage.de/national-deskfast-day/,breakfast_dining
417,03-19,Lass uns lachen Tag,Let's Laugh Day in den USA,https://www.kuriose-feiertage.de/lass-uns-lachen-tag/,sentiment_very_satisfied
418,03-20,Welttag der Frösche,World Frog Day,https://www.kuriose-feiertage.de/world-frog-day/,eco
419,03-20,Fest der Bäume,Boomfeestdag in den Niederlanden,https://www.kuriose-feiertage.de/nationale-boomfeestdag/,forest
420,03-20,Tag der Bibliomanie,Bibliomania Day in den USA,https://www.kuriose-feiertage.de/tag-der-bibliomanie/,library_books
421,03-20,Welttag des Sperlings,World Sparrow Day,https://www.kuriose-feiertage.de/welttag-des-sperlings/,pets
422,03-20,Weltglückstag,International Day of Happiness,https://www.kuriose-feiertage.de/international-day-of-happiness/,emoji_emotions
423,03-20,Tag der Ravioli,Ravioli Day in den USA,https://www.kuriose-feiertage.de/tag-der-ravioli/,restaurant
424,03-20,Weltgeschichtentag,World Storytelling Day,https://www.kuriose-feiertage.de/weltgeschichtentag/,record_voice_over
425,03-21,Tattoo Tag,World Tattoo Day & National Tattoo Day,https://www.kuriose-feiertage.de/world-tattoo-day-und-national-tattoo-day/,brush
426,03-21,Welt Down Syndrom Tag,World Down Syndrome Day,https://www.kuriose-feiertage.de/welt-down-syndrom-tag/,diversity_3
427,03-21,Welttag des Holzes,World Wood Day,https://www.kuriose-feiertage.de/world-wood-day/,forest
428,03-21,Internationaler Tag der Farbe,International Colour Day,https://www.kuriose-feiertage.de/international-colour-day/,palette
429,03-21,Internationaler Tag des Waldes,International Day of Forests,https://www.kuriose-feiertage.de/internationaler-tag-des-waldes/,park
430,03-21,Tag des Baguettes,National French Bread Day in den USA,https://www.kuriose-feiertage.de/tag-des-baguettes/,bakery_dining
431,03-21,Welttag der Poesie,UNESCO World Poetry Day,https://www.kuriose-feiertage.de/welttag-der-poesie-unseco-world-poetry-day/,menu_book
432,03-22,Tag des Berliner Bären,Ehrentag für das Wappentier Berlins,https://www.kuriose-feiertage.de/tag-des-berliner-baeren/,pets
433,03-22,Welttag der Doulas,World Doula Day,https://www.kuriose-feiertage.de/world-doula-day/,child_friendly
434,03-22,Wir lieben Brokkoli Tag,We Love Broccoli Day,https://www.kuriose-feiertage.de/wir-lieben-brokkoli-tag/,restaurant
435,03-22,Internationaler Tag der Seehunde,International Day of the Seal,https://www.kuriose-feiertage.de/international-day-of-the-seal/,cruelty_free
436,03-22,Weltwassertag,World Water Day,https://www.kuriose-feiertage.de/weltwassertag/,water_drop
437,03-22,Tag des Faulenzens,Goof Off Day in den USA,https://www.kuriose-feiertage.de/tag-des-faulenzens/,weekend
438,03-23,Melba Toast Tag,National Melba Toast Day in den USA,https://www.kuriose-feiertage.de/melba-toast-tag/,lunch_dining
439,03-23,Tag der süßen Katzenbabys,Cuddly Kitten Day in den USA,https://www.kuriose-feiertage.de/tag-der-suessen-katzenbabys/,pets
440,03-23,Welttag der Meteorologie,World Meteorological Day,https://www.kuriose-feiertage.de/welttag-der-meteorologie/,cloud
441,03-23,Tag der Chia Samen,National Chia Day in den USA,https://www.kuriose-feiertage.de/tag-der-chia-samen/,nutrition
442,03-23,Tag der Hundewelpen,National Puppy Day in den USA,https://www.kuriose-feiertage.de/tag-der-hundewelpen/,pets
443,03-23,Earth Hour,Stunde für den Klimaschutz,https://www.kuriose-feiertage.de/earth-hour/,dark_mode
444,03-24,Tag der Cocktails,National Cocktail Day in den USA,https://www.kuriose-feiertage.de/tag-der-cocktails/,local_bar
445,03-24,Europäischer Tag des handwerklich hergestellten Speiseeises,Feier des traditionellen Eishandwerks,https://www.kuriose-feiertage.de/europaeischer-tag-des-handwerklich-hergestellten-speiseeises/,icecream
446,03-24,Harry Houdini Tag,Gedenken an den Entfesselungskünstler,https://www.kuriose-feiertage.de/harry-houdini-tag/,visibility
447,03-24,Tag der Schoko Rosinen,National Chocolate Covered Raisin Day,https://www.kuriose-feiertage.de/tag-der-schoko-rosinen/,cookie
448,03-24,Elefanten zeichnen Tag,Kreativtag rund um Elefantenzeichnungen,https://www.kuriose-feiertage.de/elefanten-zeichnen-tag/,draw
449,03-25,Trandagen in Schweden,Kranichfest in Schweden,https://www.kuriose-feiertage.de/trandagen-in-schweden/,flight
450,03-25,European Talent Day,Tag der Talente,https://www.kuriose-feiertage.de/european-talent-day/,emoji_objects
451,03-25,Tag der Tolkien Lektüre,Tolkien Reading Day,https://www.kuriose-feiertage.de/tolkien-reading-day/,menu_book
452,03-25,Våffeldagen,Waffelfest in Schweden,https://www.kuriose-feiertage.de/vaffeldagen-schweden/,breakfast_dining
453,03-26,Live Long and Prosper Day,Star Trek Feiertag,https://www.kuriose-feiertage.de/live-long-and-prosper-day/,emoji_emotions
454,03-26,Tag des Spinats,National Spinach Day,https://www.kuriose-feiertage.de/tag-des-spinat/,eco
455,03-26,Tag des Nougats,National Nougat Day,https://www.kuriose-feiertage.de/tag-des-nougat/,candy
456,03-26,Erfinde Deinen eigenen Feiertag Tag,Make Up Your Own Holiday Day,https://www.kuriose-feiertage.de/erfinde-deinen-eigenen-feiertag-tag/,celebration
457,03-27,Ehrentag der Seekühe,Manatee Appreciation Day,https://www.kuriose-feiertage.de/ehrentag-der-seekuehe/,cruelty_free
458,03-27,Welttag des Theaters,World Theatre Day,https://www.kuriose-feiertage.de/welttag-des-theaters/,theater_comedy
459,03-27,Internationaler Whisky Tag,International Whisk(e)y Day,https://www.kuriose-feiertage.de/international-whiskey-day/,liquor
460,03-27,Tag der Paella,National Spanish Paella Day,https://www.kuriose-feiertage.de/tag-der-paella/,restaurant
461,03-27,Tag des Joe,National Joe Day in den USA,https://www.kuriose-feiertage.de/tag-des-joe/,person
462,03-27,Document Freedom Day,Internationaler Aktionstag für offene Standards,https://www.kuriose-feiertage.de/document-freedom-day/,description
463,03-28,Weltmaultaschentag,Feier der schwäbischen Spezialität,https://www.kuriose-feiertage.de/weltmaultaschentag/,lunch_dining
464,03-28,Welt Piano Tag,Feier des Klavierspiels weltweit,https://www.kuriose-feiertage.de/world-piano-day/,piano
465,03-28,Tag der Eierausstellung,US-amerikanischer Eggsibit Day,https://www.kuriose-feiertage.de/eggsibit-day/,egg
466,03-28,Etwas am Stiel Tag,National Something on a Stick Day,https://www.kuriose-feiertage.de/etwas-am-stiel-tag/,restaurant
467,03-28,Respektiere Deine Katze Tag,Respect Your Cat Day in den USA,https://www.kuriose-feiertage.de/respektiere-deine-katze-tag/,pets
468,03-28,Tag der Schwarzwälder Kirschtorte,National Black Forest Cake Day,https://www.kuriose-feiertage.de/tag-der-schwarzwaelder-kirschtorte/,cake
469,03-28,Ehrentag des Unkrauts,Weed Appreciation Day in den USA,https://www.kuriose-feiertage.de/ehrentag-des-unkrauts/,grass
470,03-29,Welt Murmel Tag,World Marbles Day,https://www.kuriose-feiertage.de/welt-murmel-tag/,sports_esports
471,03-29,Tu etwas Verrücktes Tag,Kreativer Aktionstag in Deutschland,https://www.kuriose-feiertage.de/einmal-am-tag-etwas-verruecktes-tun-tag/,psychology
472,03-29,Tag der Tante Emma Laden Besitzer,Mom and Pop Business Owners Day,https://www.kuriose-feiertage.de/national-mom-and-pop-business-owners-day/,store
473,03-29,Ehrentag des Blendwerks,Festival of Smoke and Mirrors Day,https://www.kuriose-feiertage.de/ehrentag-des-blendwerks/,visibility_off
474,03-30,Tag des Wäschefaltens,International Laundry Folding Day,https://www.kuriose-feiertage.de/tag-des-waeschefaltens/,dry_cleaning
475,03-30,Anderswo ist auch scheiße Tag,The Grass is Always Browner Day,https://www.kuriose-feiertage.de/anderswo-ist-auch-scheisse-tag/,sentiment_dissatisfied
476,03-30,Ärzte Tag,National Doctors' Day in den USA,https://www.kuriose-feiertage.de/national-doctors-day-usa/,medical_services
477,03-30,Spaziergang im Park Tag,Take a Walk in the Park Day,https://www.kuriose-feiertage.de/mach-einen-spaziergang-im-park-tag/,directions_walk
478,03-30,Tag des Bleistifts,National Pencil Day,https://www.kuriose-feiertage.de/tag-des-bleistifts/,edit
479,03-31,Tag der Wachsmalstifte,Crayola Crayon Day in den USA,https://www.kuriose-feiertage.de/tag-der-wachsmalstifte/,palette
480,03-31,Ehrentag für die Entenhausen Forschung,Feier des Donaldismus,https://www.kuriose-feiertage.de/tag-des-donaldismus/,auto_stories
481,03-31,Umarme einen Mediävist Tag,Hug a Medievalist Day,https://www.kuriose-feiertage.de/international-hug-a-medievalist-day/,history_edu
482,03-31,World Backup Day,Tag der Datensicherung,https://www.kuriose-feiertage.de/world-backup-day/,cloud_upload
483,03-31,Tag der Kartoffel,National Tater Day in den USA,https://www.kuriose-feiertage.de/tag-der-kartoffel-usa/,spa
484,03-31,Tag des Eiffelturms,Feier des Eiffelturms in den USA,https://www.kuriose-feiertage.de/tag-des-eiffelturms/,location_city
485,03-31,Tag des Bunsenbrenners,National Bunsen Burner Day in den USA,https://www.kuriose-feiertage.de/tag-des-bunsenbrenners/,science
486,04-01,Tag der essbaren Bücher,International Edible Book Day,https://www.kuriose-feiertage.de/international-edible-book-day/,menu_book
487,04-01,Tag des Taschenrechners,International Pocket Calculator Day,https://www.kuriose-feiertage.de/internationaler-tag-des-taschenrechners/,calculate
488,04-01,Occhi Tag,International Tatting Day,https://www.kuriose-feiertage.de/international-tatting-day/,design_services
489,04-02,Kinderbuchtag,International Children’s Book Day,https://www.kuriose-feiertage.de/internationaler-kinderbuchtag/,child_care
490,04-02,Erdnussbutter und Marmelade Sandwich Tag,National Peanut Butter & Jelly Day,https://www.kuriose-feiertage.de/erdnussbutter-marmelade-sandwich-tag/,lunch_dining
491,04-03,Wassertier-Tag,World Aquatic Animal Day,https://www.kuriose-feiertage.de/world-aquatic-animal-day/,waves
492,04-03,Tag der Arschkarte,Erinnerung an erste Rote Karte in der Bundesliga,https://www.kuriose-feiertage.de/tag-der-arschkarte/,sports_soccer
493,04-03,Tag des Gehens,National Walking Day,https://www.kuriose-feiertage.de/national-walking-day/,directions_walk
494,04-03,Finde einen Regenbogen Tag,Find a Rainbow Day,https://www.kuriose-feiertage.de/finde-einen-regenbogen-tag/,rainy
495,04-03,Tag der Schokoladen Mousse,National Chocolate Mousse Day,https://www.kuriose-feiertage.de/tag-der-schokoladen-mousse-usa/,icecream
496,04-03,Welt Party Tag,Friedliches Feiern weltweit,https://www.kuriose-feiertage.de/world-party-day/,celebration
497,04-04,Tag des Cordon Bleu,National Cordon Bleu Day,https://www.kuriose-feiertage.de/tag-des-cordon-bleu/,restaurant_menu
498,04-04,Tag der Burritos,National Burrito Day,https://www.kuriose-feiertage.de/tag-der-burritos/,fastfood
499,04-04,404 Tag,Digitale Rechte und Netzkultur,https://www.kuriose-feiertage.de/404-day/,cloud_off
500,04-04,Weltschlagzeugertag,Weltweiter Tag für Schlagzeuger,https://www.kuriose-feiertage.de/weltschlagzeugertag/,music_note
501,04-04,Tag der Karotte,International Carrot Day,https://www.kuriose-feiertage.de/internationaler-tag-der-karotte/,emoji_nature
502,04-04,Tag des Vitamin C,Feier von Vitamin C,https://www.kuriose-feiertage.de/tag-des-vitamin-c/,local_pharmacy
503,04-05,Tag des Löwenzahns,National Dandelion Day,https://www.kuriose-feiertage.de/tag-des-loewenzahns/,filter_vintage
504,04-05,Geh zu Fuß zur Arbeit Tag,National Walk to Work Day,https://www.kuriose-feiertage.de/national-walk-to-work-day-usa/,directions_walk
505,04-05,Tag des Ersten Kontakts,First Contact Day in Star Trek,https://www.kuriose-feiertage.de/first-contact-day-star-trek/,travel_explore
506,04-05,Lies eine Straßenkarte Tag,Read a Road Map Day,https://www.kuriose-feiertage.de/lies-eine-strassenkarte-tag/,map
507,04-06,Tag des Feuerlaufens,International Firewalk Day,https://www.kuriose-feiertage.de/international-firewalk-day/,whatshot
508,04-06,Twinkie Tag,National Twinkie Day,https://www.kuriose-feiertage.de/twinkie-tag/,cake
509,04-06,Tag der frischen Tomaten,Fresh Tomato Day,https://www.kuriose-feiertage.de/tag-der-frischen-tomaten/,local_florist
510,04-06,Tag des Teflons,National Teflon Day,https://www.kuriose-feiertage.de/tag-des-teflon/,science
511,04-06,Tag des Sports für Entwicklung und Frieden,International Day of Sport for Development and Peace,https://www.kuriose-feiertage.de/internationaler-tag-des-sports-fuer-entwicklung-und-frieden/,sports_soccer
512,04-06,Tartan Day,Tartan Day in Kanada und den USA,https://www.kuriose-feiertage.de/tartan-day-usa-kanada/,flag
513,04-06,Kissenschlacht Tag,International Pillow Fight Day,https://www.kuriose-feiertage.de/international-pillow-fight-day/,hotel
514,04-07,Tag der Geologen,Geologist Day,https://www.kuriose-feiertage.de/tag-der-geologen/,terrain
515,04-07,Tag der Biber,International Beaver Day,https://www.kuriose-feiertage.de/internationaler-tag-der-biber/,pest_control
516,04-07,Kuchen zum Kaffee Tag,National Coffee Cake Day,https://www.kuriose-feiertage.de/kuchen-zum-kaffee-tag/,bakery_dining
517,04-07,Tag des Bieres,National Beer Day,https://www.kuriose-feiertage.de/national-beer-day-usa/,sports_bar
518,04-07,Keine Hausarbeit Tag,No Housework Day,https://www.kuriose-feiertage.de/keine-hausarbeit-tag/,cleaning_services
519,04-08,Rex Manning Day,US-amerikanischer Kulttag,https://www.kuriose-feiertage.de/rex-manning-day/,mic_external_on
520,04-08,Blumenfest Hana Matsuri,Buddhas Geburtstag in Japan,https://www.kuriose-feiertage.de/blumenfest-hana-matsuri-japan/,spa
521,04-08,Das gehört uns allen Tag,All Is Ours Day,https://www.kuriose-feiertage.de/das-gehoert-uns-allen-tag/,public
522,04-08,Zeichne einen Vogel Tag,Draw a Bird Day,https://www.kuriose-feiertage.de/draw-a-bird-day/,brush
523,04-09,Gin Tonic Tag,International Gin and Tonic Day,https://www.kuriose-feiertage.de/gin-tonic-tag/,local_bar
524,04-09,Tag des Einhorns,International Unicorn Day,https://www.kuriose-feiertage.de/internationaler-tag-des-einhorns/,auto_awesome
525,04-09,Ehrentag der Antiquitäten,Cherish an Antique Day,https://www.kuriose-feiertage.de/ehrentag-der-antiquitaeten/,museum
526,04-09,Wähle Dir Deinen Namen Tag,Name Yourself Day,https://www.kuriose-feiertage.de/waehle-dir-deinen-namen/,badge
527,04-09,Winston Churchill Tag,Winston Churchill Day,https://www.kuriose-feiertage.de/winston-churchill-tag/,military_tech
528,04-10,Tag der Golfer,Golfers Day,https://www.kuriose-feiertage.de/tag-der-golfer/,golf_course
529,04-10,Ermutige Kinder zu schreiben Tag,Encourage a Young Writer Day,https://www.kuriose-feiertage.de/ermutige-kinder-zu-schreiben-tag/,edit
530,04-10,Tag des Zimt Croissants,Cinnamon Crescent Day,https://www.kuriose-feiertage.de/tag-des-zimt-croissants/,bakery_dining
531,04-10,Tag der Nutztiere,Farm Animals Day,https://www.kuriose-feiertage.de/tag-der-nutztiere/,agriculture
532,04-10,Tag der Sicherheitsnadel,International Safety Pin Day,https://www.kuriose-feiertage.de/internationaler-tag-der-sicherheitsnadel/,safety_divider
533,04-10,Tag der Geschwister,Siblings Day,https://www.kuriose-feiertage.de/tag-der-geschwister/,diversity_3
534,04-11,Tag der Freesien,Freesia Day in Germany,https://www.kuriose-feiertage.de/tag-der-freesien/,local_florist
535,04-11,Welt Parkinson Tag,World Parkinson's Day,https://www.kuriose-feiertage.de/welt-parkinson-tag/,healing
536,04-11,Tag des Käsefondues,Cheese Fondue Day,https://www.kuriose-feiertage.de/tag-des-kaesefondue/,restaurant
537,04-11,Tag der Haustiere,Pet Day,https://www.kuriose-feiertage.de/tag-der-haustiere/,pets
538,04-11,Unsichtbarkeitstag,Invisibility Day in Germany,https://www.kuriose-feiertage.de/unsichtbarkeitstag/,visibility_off
539,04-12,Drop Everything and Read Day,D.E.A.R. Day,https://www.kuriose-feiertage.de/drop-everything-and-read-day/,menu_book
540,04-12,Tag der bemannten Raumfahrt,International Day of Human Space Flight,https://www.kuriose-feiertage.de/internationaler-tag-der-bemannten-raumfahrt/,rocket_launch
541,04-12,Tag der Einzelkinder,Only Child Day,https://www.kuriose-feiertage.de/tag-der-einzelkinder/,person
542,04-12,Lakritztag,Lakritztag (Licorice Day),https://www.kuriose-feiertage.de/lakritztag/,candy
543,04-12,Tag des Schweigens,Day of Silence,https://www.kuriose-feiertage.de/tag-des-schweigens/,volume_off
544,04-12,Tag des starken Windes,Big Wind Day,https://www.kuriose-feiertage.de/national-big-wind-day/,air
545,04-12,Zeig Deine wilde Seite Tag,Walk on Your Wild Side Day,https://www.kuriose-feiertage.de/walk-on-your-wild-side-day/,pets
546,04-13,Mittagessen ist wichtig Tag,Make Lunch Count Day,https://www.kuriose-feiertage.de/mittagessen-ist-wichtig-tag/,lunch_dining
547,04-13,Scrabble Tag zu Ehren von Alfred Mosher Butts,Scrabble Day,https://www.kuriose-feiertage.de/scrabble-tag/,spellcheck
548,04-13,Internationaler Ehrentag der Pflanze,Plant Appreciation Day,https://www.kuriose-feiertage.de/international-plant-appreciation-day/,eco
549,04-14,Welttag der Quanten,World Quantum Day,https://www.kuriose-feiertage.de/world-quantum-day/,science
550,04-14,Tag des Gärtnerns,Gardening Day,https://www.kuriose-feiertage.de/tag-des-gaertnerns/,yard
551,04-14,Black Day,Schwarzer Tag in Südkorea,https://www.kuriose-feiertage.de/black-day-suedkorea/,dark_mode
552,04-14,Tag der Delfine,Dolphin Day,https://www.kuriose-feiertage.de/tag-der-delfine/,waves
553,04-14,Tag der Pekannuss,Pecan Day,https://www.kuriose-feiertage.de/tag-der-pekannuss/,restaurant
554,04-14,Schau in den Himmel Tag,Look Up at the Sky Day,https://www.kuriose-feiertage.de/schau-in-den-himmel-tag/,sky
555,04-15,Mecker Tag,Griper's Day,https://www.kuriose-feiertage.de/mecker-tag/,mood_bad
556,04-15,Titanic Gedenktag,Gedenken an den Untergang der Titanic,https://www.kuriose-feiertage.de/titanic-gedenktag/,directions_boat
557,04-15,Tag der Kunst,World Art Day,https://www.kuriose-feiertage.de/art-day/,brush
558,04-15,Alles ist scheiße Tag,That Sucks Day,https://www.kuriose-feiertage.de/alles-ist-scheisse-tag/,sentiment_very_dissatisfied
559,04-15,Tag des Radiergummis,Rubber Eraser Day,https://www.kuriose-feiertage.de/tag-des-radiergummis/,edit
560,04-16,Komm im Schlafanzug zur Arbeit Tag,Wear Pajamas to Work Day,https://www.kuriose-feiertage.de/komm-im-schlafanzug-zur-arbeit-tag/,hotel
561,04-16,World Semicolon Day,Semicolon Awareness Day,https://www.kuriose-feiertage.de/world-semicolon-day/,code
562,04-16,Tag der Orchidee,Orchid Day,https://www.kuriose-feiertage.de/national-orchid-day/,local_florist
563,04-16,Internationaler Tag der Stimme,World Voice Day,https://www.kuriose-feiertage.de/world-voice-day/,record_voice_over
564,04-16,Eier Benedict Tag,Eggs Benedict Day,https://www.kuriose-feiertage.de/eggs-benedict-tag/,brunch_dining
565,04-17,Welttag des Malbec,Malbec World Day,https://www.kuriose-feiertage.de/malbec-world-day/,wine_bar
566,04-17,Welttag der Hämophilie,World Hemophilia Day,https://www.kuriose-feiertage.de/welttag-der-haemophilie/,healing
567,04-17,Ehrentag der Fledermaus,Bat Appreciation Day,https://www.kuriose-feiertage.de/ehrentag-der-fledermaus-usa/,cruelty_free
568,04-17,Tag der Banane,Banana Day,https://www.kuriose-feiertage.de/banana-day-usa/,emoji_food_beverage
569,04-17,BlaBlabBla Tag,Blah Blah Blah Day,https://www.kuriose-feiertage.de/blablabbla-tag/,record_voice_over
570,04-18,Internationaler Denkmaltag,Day for Monuments and Sites,https://www.kuriose-feiertage.de/internationaler-denkmaltag/,account_balance
571,04-18,Tag des Jonglierens,Jugglers Day,https://www.kuriose-feiertage.de/tag-des-jonglierens/,sports_gymnastics
572,04-18,Tag des Velociraptors,Velociraptor Awareness Day,https://www.kuriose-feiertage.de/tag-des-velociraptors/,pets
573,04-18,Gib mir Fünf Tag,High Five Day,https://www.kuriose-feiertage.de/national-high-five-day-usa/,emoji_people
574,04-18,Weltamateurfunktag,World Amateur Radio Day,https://www.kuriose-feiertage.de/weltamateurfunktag/,radio
575,04-18,Tag der Zeitungskolumnisten,Columnists' Day,https://www.kuriose-feiertage.de/tag-der-zeitungskolumnisten/,article
576,04-18,Tag der Tier Kekse,Animal Crackers Day,https://www.kuriose-feiertage.de/national-animal-crackers-day-usa/,lunch_dining
577,04-18,Poem in Your Pocket Day,Poem in Your Pocket Day,https://www.kuriose-feiertage.de/poem-in-your-pocket-day/,menu_book
578,04-19,Primel Tag,Primrose Day,https://www.kuriose-feiertage.de/primrose-day/,local_florist
579,04-19,Tag des Wäscheaufhängens,Hanging Out Day,https://www.kuriose-feiertage.de/tag-des-waescheaufhaengens/,dry_cleaning
580,04-19,Knoblauch Tag,Garlic Day,https://www.kuriose-feiertage.de/tag-des-knoblauchs/,restaurant
581,04-19,Bicycle Day,Bicycle Day,https://www.kuriose-feiertage.de/bicycle-day/,directions_bike
582,04-20,Tag der Cheddar Fries,Cheddar Fries Day,https://www.kuriose-feiertage.de/national-cheddar-fries-day/,fastfood
583,04-20,Tag der chinesischen Sprache,Chinese Language Day,https://www.kuriose-feiertage.de/tag-der-chinesischen-sprache/,translate
584,04-20,420,Cannabis Tag / Pot Smokers Day,https://www.kuriose-feiertage.de/420/,grass
585,04-20,Tag der Doppelgänger,Look Alike Day,https://www.kuriose-feiertage.de/tag-der-doppelgaenger/,face
586,04-21,Rasen betreten verboten Tag,Keep off the Grass Day,https://www.kuriose-feiertage.de/rasen-betreten-verboten-tag/,landscape
587,04-21,Tag des Tees,British National Tea Day,https://www.kuriose-feiertage.de/british-national-tea-day/,local_cafe
588,04-21,Tag der langen Wörter,Big Word Day,https://www.kuriose-feiertage.de/tag-der-langen-woerter-und-begriffe/,text_fields
589,04-21,Nessie-Foto-Tag,Tag des berühmtesten Nessie Fotos,https://www.kuriose-feiertage.de/tag-des-beruehmtesten-nessie-fotos/,visibility
590,04-21,Kindergarten Tag,Kindergarten Day,https://www.kuriose-feiertage.de/kindergarten-tag/,child_care
591,04-22,Tag der Aprilschauer,April Showers Day,https://www.kuriose-feiertage.de/tag-der-aprilschauer/,rainy
592,04-22,Tag der Jelly Beans,Jelly Bean Day,https://www.kuriose-feiertage.de/tag-der-jelly-beans/,candy
593,04-22,Tag der Erde,Earth Day,https://www.kuriose-feiertage.de/tag-der-erde-earth-day/,public
594,04-23,Ramones Tag,International Ramones Day,https://www.kuriose-feiertage.de/international-ramones-day/,music_note
595,04-23,Tag der Pallaskatze,International Pallas’s Cat Day,https://www.kuriose-feiertage.de/international-pallas-cat-day/,pets
596,04-23,World Book Night,"Book Night in UK, Ireland and USA",https://www.kuriose-feiertage.de/world-book-night/,menu_book
597,04-23,Vespa Tag,Vespa Patenttag,https://www.kuriose-feiertage.de/vespa-tag/,two_wheeler
598,04-23,Sprich wie Shakespeare Tag,Talk Like Shakespeare Day,https://www.kuriose-feiertage.de/talk-like-shakespeare-day/,theater_comedy
599,04-23,Tag des Nasenbohrens,Nose Picking Day,https://www.kuriose-feiertage.de/internationaler-tag-des-nasenbohrens/,emoji_emotions
