id,date,name,desc,link,icon
0,01-01,Gott sei Dank ist Montag Tag,National Thank God It’s Monday Day,https://www.kuriose-feiertage.de/gott-sei-dank-ist-montag-tag/,sentiment_satisfied
1,01-01,Katertag,Hangover Day in den USA,https://www.kuriose-feiertage.de/national-hangover-day/,local_bar
2,01-01,Tag des Glücksschweins,Glücksschwein-Feier in Deutschland,https://www.kuriose-feiertage.de/tag-des-gluecksschweins/,pets
3,01-01,Bloody Mary Tag,Cocktail-Feier in den USA,https://www.kuriose-feiertage.de/bloody-mary-tag/,liquor
4,01-01,Verschenk einen Apfel Tag,Apple Gifting Day,https://www.kuriose-feiertage.de/verschenk-einen-apfel-tag/,apple
5,01-01,Tag des Buchstaben Z,Z Day in den USA,https://www.kuriose-feiertage.de/tag-des-buchstaben-z-der-amerikanische-z-day/,font_download
6,01-01,Bonza Bottler Day,US-Feier für den Monatsanfang,https://www.kuriose-feiertage.de/bonza-bottler-day/,calendar_today
7,01-02,Tag der Introvertierten,World Introvert Day,https://www.kuriose-feiertage.de/tag-der-introvertierten/,person_off
8,01-02,Tag des Schweizer Käses,Swiss Cheese Day in den USA,https://www.kuriose-feiertage.de/tag-des-schweizer-kaeses/,restaurant
9,01-02,Waldmännchentag,Traditioneller Feiertag in Deutschland,https://www.kuriose-feiertage.de/waldmaennchentag/,park
10,01-02,Tag des Buffets,Buffet-Feier in den USA,https://www.kuriose-feiertage.de/national-buffet-day-usa/,restaurant_menu
11,01-02,Tag der Windbeutel,Cream Puff Day in den USA,https://www.kuriose-feiertage.de/tag-der-windbeutel-usa/,cake
12,01-02,Katzen Neujahr,Happy Mew Year for Cats Day,https://www.kuriose-feiertage.de/katzen-neujahr-happy-mew-year-for-cats-day/,pets
13,01-02,Science Fiction Tag,National Science Fiction Day,https://www.kuriose-feiertage.de/national-science-fiction-day-usa/,science
14,01-03,Women Rock! Day,Internationaler Ehrentag für Frauen im Rock,https://www.kuriose-feiertage.de/women-rock-day/,music_note
15,01-03,J.R.R. Tolkien Day,Feier zu Ehren des Autors,https://www.kuriose-feiertage.de/jrr-tolkien-day/,menu_book
16,01-03,Tag der schokolierten Kirschen,Chocolate Covered Cherry Day,https://www.kuriose-feiertage.de/tag-der-schokolierten-kirschen-usa/,cookie
17,01-03,Tag des Schlafens,Festival of Sleep Day,https://www.kuriose-feiertage.de/festival-of-sleep-day-usa/,bed
18,01-03,Tag des Strohhalms,Drinking Straw Day in den USA,https://www.kuriose-feiertage.de/tag-des-strohhalms-usa/,emoji_food_beverage
19,01-04,Verschenk einen Blumenkorb Tag,Free Flower Basket Day,https://www.kuriose-feiertage.de/verschenk-einen-blumenkorb-tag/,local_florist
20,01-04,Tag der Mandarine,Mandarinen-Feier in Deutschland,https://www.kuriose-feiertage.de/tag-der-mandarine/,nutrition
21,01-04,Welt Braille Tag,World Braille Day,https://www.kuriose-feiertage.de/welt-braille-tag/,visibility_off
22,01-04,Tag des Trivialwissens,National Trivia Day,https://www.kuriose-feiertage.de/national-trivia-day-usa/,quiz
23,01-04,Spaghetti Tag,National Spaghetti Day in den USA,https://www.kuriose-feiertage.de/spaghetti-tag-usa/,restaurant
24,01-05,Tag der Drehbuchautoren,National Screenwriters Day in den USA,https://www.kuriose-feiertage.de/tag-der-drehbuchautoren/,edit_note
25,01-05,Tag der Schlagsahne,US-amerikanischer National Whipped Cream Day,https://www.kuriose-feiertage.de/tag-der-schlagsahne/,icecream
26,01-05,Tag des Vogels,National Bird Day in den Vereinigten Staaten,https://www.kuriose-feiertage.de/national-bird-day-usa/,pets
27,01-06,Nollaig na mBan,Irischer Frauentag,https://www.kuriose-feiertage.de/little-christmas-in-irland/,celebration
28,01-06,Tag der Frau Holle,Frau Holle und das Ende der Rauhnächte,https://www.kuriose-feiertage.de/tag-der-frau-holle/,cloud
29,01-06,La Befana,Nacht der Weihnachtshexe Befana in Italien,https://www.kuriose-feiertage.de/nacht-der-befana-in-italien/,elf
30,01-06,Bau den Weihnachtsbaum ab Tag,National Take Down the Christmas Tree Day,https://www.kuriose-feiertage.de/bau-den-weihnachtsbaum-ab-tag/,forest
31,01-06,Tag des schottischen Shortbread,National Shortbread Day in den USA,https://www.kuriose-feiertage.de/tag-des-schottischen-shortbread/,cake
32,01-06,Tag der Bohne,US-amerikanischer National Bean Day,https://www.kuriose-feiertage.de/tag-der-bohne/,spa
33,01-06,Tag des Kuschelns,National Cuddle Up Day in den USA,https://www.kuriose-feiertage.de/tag-des-kuschelns-cuddle-up-day/,favorite
34,01-07,International Silly Walks Day,Humorvoller Aktionstag inspiriert von Monty Python,https://www.kuriose-feiertage.de/international-silly-walks-day/,emoji_people
35,01-07,No Pants Subway Ride,Internationaler No Pants Subway Ride,https://www.kuriose-feiertage.de/no-pants-subway-ride/,directions_subway
36,01-07,Furz Tag,US-amerikanischer National Pass Gas Day,https://www.kuriose-feiertage.de/furz-tag-in-den-usa/,wind_power
37,01-07,Ich lasse mir das nicht mehr bieten Tag,I’m Not Going To Take It Anymore Day in den USA,https://www.kuriose-feiertage.de/ich-lasse-mir-das-nicht-mehr-bieten-tag/,campaign
38,01-07,Tag der Fossilien und alten Steine,US-amerikanischer Old Rock Day,https://www.kuriose-feiertage.de/tag-der-fossilien-und-alten-steine/,landscape
39,01-08,Tag des Maschinenschreibens,International Typing Day,https://www.kuriose-feiertage.de/international-typing-day/,keyboard
40,01-08,Fest der Frauen,Yinekokratia in Griechenland,https://www.kuriose-feiertage.de/fest-der-frauen-griechenland/,woman
41,01-08,Räum Deinen Schreibtisch auf Tag,National Clean off Your Desk Day,https://www.kuriose-feiertage.de/raeum-deinen-schreibtisch-auf-tag/,cleaning_services
42,01-08,Tag des English Toffee,National English Toffee Day in den USA,https://www.kuriose-feiertage.de/tag-des-english-toffee/,candy
43,01-08,Mitbringtag auf der Arbeit,Show and Tell Day at Work Day,https://www.kuriose-feiertage.de/show-and-tell-day-at-work-day-usa/,work
44,01-08,Tag des Schaumbads,National Bubble Bath Day in den USA,https://www.kuriose-feiertage.de/tag-des-schaumbads-bubble-bath-day/,bathtub
45,01-09,Tag der 1. Ballonfahrt,National Balloon Ascension Day oder Aviation in America Day,https://www.kuriose-feiertage.de/tag-der-ersten-ballonfahrt-usa/,travel
46,01-09,Tag der Aprikose,National Apricot Day in den Vereinigten Staaten,https://www.kuriose-feiertage.de/tag-der-aprikose/,nutrition
47,01-09,Spiele Gott Tag,US-amerikanischer Play God Day,https://www.kuriose-feiertage.de/play-god-day/,psychology
48,01-10,Internationaler Depeche Mode Day,Internationaler Depeche Mode Day,https://www.kuriose-feiertage.de/international-depeche-mode-day/,music_note
49,01-10,Tag der Typen,Peculiar People Day in den USA,https://www.kuriose-feiertage.de/peculiar-people-day/,emoji_people
50,01-10,Rettet die Adler Tag,US-amerikanischer Save the Eagles Day,https://www.kuriose-feiertage.de/save-the-eagles-day-usa/,emoji_nature
51,01-10,Tag der Zartbitterschokolade,National Bittersweet Chocolate Day in den USA,https://www.kuriose-feiertage.de/tag-der-zartbitterschokolade/,cake
52,01-10,Tag der Blockflöte,Bundesweiter Tag der Blockflöte in Deutschland,https://www.kuriose-feiertage.de/tag-der-blockfloete/,music_note
53,01-10,Tag der Zimmerpflanzen,US-amerikanischer Houseplant Appreciation Day,https://www.kuriose-feiertage.de/tag-der-zimmerpflanzen/,local_florist
54,01-11,Tag des Pfützenspringens,National Step in a Puddle and Splash Your Friend Day,https://www.kuriose-feiertage.de/step-in-a-puddle-and-splash-your-friend-day/,umbrella
55,01-11,Internationaler Dankeschön Tag,International Thank You Day,https://www.kuriose-feiertage.de/international-thank-you-day/,volunteer_activism
56,01-11,Tag der Milch,National Milk Day in den USA,https://www.kuriose-feiertage.de/national-milk-day-usa/,local_cafe
57,01-11,Tag des deutschen Apfels,Feiertag rund um den deutschen Apfel,https://www.kuriose-feiertage.de/tag-des-deutschen-apfels/,eco
58,01-12,Küsse Rothaarige Tag,International Kiss a Ginger Day,https://www.kuriose-feiertage.de/kuesse-rothaarige-tag/,favorite
59,01-12,Chicken Curry Tag,National Curried Chicken Day in den USA,https://www.kuriose-feiertage.de/chicken-curry-tag/,restaurant
60,01-12,Fest der wilden Kerle,US-amerikanischer Feast of Fabulous Wild Men Day,https://www.kuriose-feiertage.de/fest-der-wilden-kerle/,sports_kabaddi
61,01-12,Tag des Marzipans,National Marzipan Day in den Vereinigten Staaten,https://www.kuriose-feiertage.de/tag-des-marzipan-usa/,bakery_dining
62,01-13,Tag des Pfirsich Melba,National Peach Melba Day in den Vereinigten Staaten,https://www.kuriose-feiertage.de/pfirsich-melba-tag/,icecream
63,01-13,Fest des Hilarius von Poitiers,Kältester Tag des Jahres in Großbritannien,https://www.kuriose-feiertage.de/kaeltester-tag-des-jahres-in/,ac_unit
64,01-13,Tag der Aufkleber,National Sticker Day in den Vereinigten Staaten,https://www.kuriose-feiertage.de/tag-der-aufkleber/,label
65,01-13,Verwirkliche Deine Träume Tag,US-amerikanischer Make Your Dreams Come True Day,https://www.kuriose-feiertage.de/verwirkliche-deine-traeume-tag/,auto_awesome
66,01-13,Tag des Quietscheentchens,Rubber Ducky Day in den USA,https://www.kuriose-feiertage.de/tag-des-quietscheentchens/,toys
67,01-13,St. Knut Tag,St. Knut Tag in Skandinavien,https://www.kuriose-feiertage.de/st-knut-tag/,festival
68,01-14,Tag des Drachensteigens,Uttarayan: International Kite Day in Indien,https://www.kuriose-feiertage.de/uttarayan-international-kite-day/,air
69,01-14,Welttag der Logik,Internationaler World Logic Day,https://www.kuriose-feiertage.de/welttag-der-logik/,psychology
70,01-14,Zieh dein Haustier an Tag,US-amerikanischer Dress Up Your Pet Day,https://www.kuriose-feiertage.de/zieh-dein-haustier-an-tag/,pets
71,01-14,Schaff Ordnung in Deiner Wohnung Tag,Organize Your Home Day in den USA,https://www.kuriose-feiertage.de/schaff-ordnung-in-deiner-wohnung-tag/,cleaning_services
72,01-15,Tag des Schlaglochs,National Pothole Day in Großbritannien,https://www.kuriose-feiertage.de/tag-des-schlaglochs/,car_repair
73,01-15,Tag des Bagels,US-amerikanischer National Bagel Day,https://www.kuriose-feiertage.de/tag-des-bagels/,breakfast_dining
74,01-15,Martin Luther King Jr. Day,Feiertag in den Vereinigten Staaten,https://www.kuriose-feiertage.de/martin-luther-king-day/,diversity_3
75,01-15,Tag des Hutes,US-amerikanischer Hat Day,https://www.kuriose-feiertage.de/tag-des-hutes-usa/,checkroom
76,01-15,Tag des frisch gepressten Fruchtsafts,National Fresh Squeezed Juice Day in den USA,https://www.kuriose-feiertage.de/tag-des-frisch-gepressten-fruchtsaft/,local_bar
77,01-15,Tag des Erdbeereises,US-amerikanischer Strawberry Ice Cream Day,https://www.kuriose-feiertage.de/tag-des-erdbeereis/,icecream
78,01-16,Befreie die Welt von Modediäten Tag,Rid the World of Fad Diets and Gimmicks Day,https://www.kuriose-feiertage.de/befreie-die-welt-von-modediaeten-tag/,fitness_center
79,01-16,Internationaler Tag der scharfen Gerichte,International Hot and Spicy Food Day,https://www.kuriose-feiertage.de/international-hot-and-spicy-food-day/,whatshot
80,01-16,Ehrentag des Drachens,US-amerikanischer Appreciate a Dragon Day,https://www.kuriose-feiertage.de/ehrentag-des-drachen/,emoji_objects
81,01-16,Nichts Tag,National Nothing Day in den USA,https://www.kuriose-feiertage.de/national-nothing-day/,do_not_disturb_on
82,01-17,Tag der italienischen Küche,International Day of Italian Cuisines,https://www.kuriose-feiertage.de/tag-der-italienischen-kueche/,restaurant_menu
83,01-17,Tag der Kinder Erfinder,US-amerikanischer Kid Inventors' Day,https://www.kuriose-feiertage.de/tag-der-kinder-erfinder/,lightbulb
84,01-17,Tag des Hot Buttered Rum,National Hot Buttered Rum Day in den USA,https://www.kuriose-feiertage.de/national-hot-buttered-rum-day/,local_bar
85,01-17,Tag der Kabelstraßenbahn,Cable Car Day in den USA,https://www.kuriose-feiertage.de/cable-car-day-usa/,tram
86,01-17,Wirf Deine Neujahrsvorsätze über Bord Tag,Ditch New Year’s Resolutions Day in den USA,https://www.kuriose-feiertage.de/wirf-deine-neujahrsvorsaetze-ueber-bord-tag/,delete_forever
87,01-17,Internationaler Museum Selfie Day,#MuseumSelfie Day,https://www.kuriose-feiertage.de/museum-selfie-day/,camera_alt
88,01-17,Art’s Birthday,Robert Filliou und der Geburtstag der Kunst,https://www.kuriose-feiertage.de/arts-birthday-geburtstag-der-kunst/,palette
89,01-18,Tag des Gourmetkaffees,National Gourmet Coffee Day in den USA,https://www.kuriose-feiertage.de/tag-des-gourmetkaffees-usa/,coffee
90,01-18,Thesaurus Tag,National Thesaurus Day in den USA,https://www.kuriose-feiertage.de/national-thesaurus-day-usa/,menu_book
91,01-18,Winnie Puuh Tag,Winnie the Pooh Day weltweit,https://www.kuriose-feiertage.de/winnie-puuh-tag/,child_friendly
92,01-18,Welttag des Schneemanns,World Day of Snowman,https://www.kuriose-feiertage.de/welttag-des-schneemanns/,ac_unit
93,01-19,Welt Quark Tag,World Quark Day,https://www.kuriose-feiertage.de/world-quark-day/,restaurant
94,01-19,Internationaler Fetisch Tag,International Fetish Day,https://www.kuriose-feiertage.de/international-fetish-day/,favorite
95,01-19,Konserven Tag,National Tin Can Day in den USA,https://www.kuriose-feiertage.de/konserven-tag-usa/,inventory_2
96,01-19,Tag des Popcorns,National Popcorn Day in den USA,https://www.kuriose-feiertage.de/national-popcorn-day-usa/,local_movies
97,01-19,Tag des Poe Toaster,US-amerikanische Poe Toaster Tradition,https://www.kuriose-feiertage.de/der-tag-des-poe-toaster/,psychology
98,01-20,Tag der Kaffeepause,Coffee Break Day in den USA,https://www.kuriose-feiertage.de/tag-der-kaffeepause/,free_breakfast
99,01-20,Trommelfest von San Sebastián,Tamborrada in San Sebastián,https://www.kuriose-feiertage.de/tamborrada/,music_note
100,01-20,Tag der Pinguine,Penguin Awareness Day in den USA,https://www.kuriose-feiertage.de/penguin-awareness-day-usa/,emoji_nature
101,01-20,Tag der Käseliebhaber,Cheese Lovers Day in den USA,https://www.kuriose-feiertage.de/national-cheese-lovers-day-usa/,lunch_dining
102,01-21,World Snow Day,Internationaler Schneetag,https://www.kuriose-feiertage.de/world-snow-day/,downhill_skiing
103,01-21,Tag des Müsliriegels,Granola Bar Day in den USA,https://www.kuriose-feiertage.de/tag-des-muesliriegels/,breakfast_dining
104,01-21,Ehrentag des Eichhörnchens,Squirrel Appreciation Day in den USA,https://www.kuriose-feiertage.de/squirrel-appreciation-day-usa/,emoji_nature
105,01-21,Internationaler Jogginghosentag,Tag der gemütlichen Kleidung,https://www.kuriose-feiertage.de/internationaler-jogginghosentag/,weekend
106,01-21,Weltknuddeltag,Internationaler Tag des Umarmens,https://www.kuriose-feiertage.de/weltknuddeltag/,volunteer_activism
107,01-22,Tag des Punktmusters,National Polka Dot Day in den USA,https://www.kuriose-feiertage.de/tag-des-punktmusters/,pattern
108,01-22,Tag der scharfen Saucen,National Hot Sauce Day in den USA,https://www.kuriose-feiertage.de/tag-der-scharfen-saucen-usa/,local_fire_department
109,01-22,Beantworte die Fragen Deiner Katze Tag,Answer Your Cat’s Question Day in den USA,https://www.kuriose-feiertage.de/beantworte-die-fragen-deiner-katze-tag/,pets
110,01-22,Tag des hellen Brownies,National Blonde Brownie Day in den USA,https://www.kuriose-feiertage.de/tag-des-hellen-brownie/,cookie
111,01-23,Tag der Bounty,Bounty Day auf Pitcairn Island,https://www.kuriose-feiertage.de/tag-der-bounty/,sailing
112,01-23,Tag des Fußvermessens,Measure Your Feet Day in den USA,https://www.kuriose-feiertage.de/measure-your-feet-day-usa/,footprint
113,01-23,Kuchen Tag,National Pie Day in den USA,https://www.kuriose-feiertage.de/kuchen-tag-usa/,bakery_dining
114,01-23,Tag der Handschrift,National Handwriting Day in den USA,https://www.kuriose-feiertage.de/national-handwriting-day-usa/,draw
115,01-24,Internationaler Tag der Bildung,UNESCO International Day of Education,https://www.kuriose-feiertage.de/internationaler-tag-der-bildung/,school
116,01-24,National Library Shelfie Day,US-amerikanischer Bibliotheksfoto-Tag,https://www.kuriose-feiertage.de/national-library-shelfie-day/,photo_library
117,01-24,Ehrentag der Bierdose,Beer Can Appreciation Day in den USA,https://www.kuriose-feiertage.de/ehrentag-der-bierdose/,sports_bar
118,01-24,Tag der Erdnussbutter,National Peanut Butter Day in den USA,https://www.kuriose-feiertage.de/tag-der-erdnussbutter/,lunch_dining
119,01-24,Welttag des herzhaften Lachens,Global Belly Laugh Day,https://www.kuriose-feiertage.de/global-belly-laugh-day/,sentiment_very_satisfied
120,01-24,Tag der Komplimente,Compliment Day in den USA,https://www.kuriose-feiertage.de/compliment-day-tag-der-komplimente/,thumb_up
121,01-25,Tag der Heiligen Dwynwen,Waliser Feiertag zu Ehren von Saint Dwynwen,https://www.kuriose-feiertage.de/tag-der-heiligen-dwynwen/,favorite
122,01-25,Tag der Wetterbeobachtung,Observe the Weather Day in den USA,https://www.kuriose-feiertage.de/tag-der-wetterbeobachtung/,cloud
123,01-25,Burns Supper,Abend zu Ehren von Robert Burns in Schottland,https://www.kuriose-feiertage.de/burns-supper-schottland/,restaurant
124,01-25,Gegenteiltag,National Opposite Day in den USA,https://www.kuriose-feiertage.de/gegenteiltag/,swap_horiz
125,01-26,World Environmental Education Day,Welttag der Umweltbildung,https://www.kuriose-feiertage.de/world-environmental-education-day/,eco
126,01-26,Tag der Ehepartner,National Spouses Day in den USA,https://www.kuriose-feiertage.de/tag-der-ehepartner/,favorite
127,01-26,Versteck einen Kuchen Tag,Hide a Cake Day in den USA,https://www.kuriose-feiertage.de/hide-a-cake-day-usa/,cake
128,01-26,Tag des Kohlsafts,National Green Juice Day in den USA,https://www.kuriose-feiertage.de/tag-des-kohlsaft/,local_drink
129,01-26,Tag des Erdnusskrokants,National Peanut Brittle Day in den USA,https://www.kuriose-feiertage.de/tag-des-erdnusskrokant/,candy
130,01-26,Australia Day,Australischer Nationalfeiertag,https://www.kuriose-feiertage.de/australia-day/,flag
131,01-27,Tag der Stechuhr,Punch the Clock Day in den USA,https://www.kuriose-feiertage.de/tag-der-stechuhr/,schedule
132,01-27,Thomas Crapper Day,Feiertag in Großbritannien,https://www.kuriose-feiertage.de/thomas-crapper-day/,plumbing
133,01-27,Tag der eulerschen Zahl,Internationaler e Day,https://www.kuriose-feiertage.de/tag-der-eulerschen-zahl/,functions
134,01-27,Tag des Schokoladenkuchens,National Chocolate Cake Day in den USA,https://www.kuriose-feiertage.de/tag-des-schokoladenkuchens/,bakery_dining
135,01-27,Tag der familiären Leseförderung,Family Literacy Day in Kanada,https://www.kuriose-feiertage.de/family-literacy-day-in-kanada/,menu_book
136,01-28,Europäischer Datenschutztag,Data Protection Day,https://www.kuriose-feiertage.de/europaeischer-datenschutztag/,privacy_tip
137,01-28,Internationaler LEGO Tag,International LEGO Day,https://www.kuriose-feiertage.de/international-lego-day/,toys
138,01-28,Gänseblümchen Tag,Daisy Day in den USA,https://www.kuriose-feiertage.de/gaensebluemchen-tag/,local_florist
139,01-28,Tag der Kazoo,National Kazoo Day in den USA,https://www.kuriose-feiertage.de/tag-der-kazoo/,music_note
140,01-28,Tag des Blaubeerpfannkuchens,National Blueberry Pancake Day in den USA,https://www.kuriose-feiertage.de/tag-des-blaubeerpfannkuchen/,breakfast_dining
141,01-28,Fun at Work Day,Nationale Spaß-im-Büro-Tag in den USA,https://www.kuriose-feiertage.de/fun-at-work-day/,emoji_emotions
142,01-29,Tag der Nelken,National Carnation Day in den USA,https://www.kuriose-feiertage.de/tag-der-nelken/,local_florist
143,01-29,Tag der Maischips,National Corn Chip Day in den USA,https://www.kuriose-feiertage.de/tag-der-maischips/,restaurant
144,01-29,Ehrentag der Luftpolsterfolie,Bubble Wrap Appreciation Day in den USA,https://www.kuriose-feiertage.de/bubble-wrap-appreciation-day/,blur_on
145,01-29,Griesgram Tag,Curmudgeons Day zu Ehren W.C. Fields,https://www.kuriose-feiertage.de/griesgram-tag/,mood_bad
146,01-29,Tag des Puzzles,National Puzzle Day in den USA,https://www.kuriose-feiertage.de/tag-des-puzzles-usa/,extension
147,01-30,Tag der Saudade,Dia da Saudade in Brasilien,https://www.kuriose-feiertage.de/dia-da-saudade/,sentiment_satisfied
148,01-30,Tag des Nachbarschafts Jodelns,Yodel for Your Neighbors Day in den USA,https://www.kuriose-feiertage.de/tag-des-nachbarschafts-jodelns/,record_voice_over
149,01-30,Tag der Alltagsflucht,National Escape Day in den USA,https://www.kuriose-feiertage.de/tag-des-alltagsflucht/,flight
150,01-30,Tag der sinnlosen Anrufbeantworter Nachrichten,Inane Answering Message Day,https://www.kuriose-feiertage.de/tag-der-sinnlosen-anrufbeantworter-nachrichten/,voicemail
151,01-30,Tag des Croissants,National Croissant Day in den USA,https://www.kuriose-feiertage.de/tag-des-croissants/,bakery_dining
152,01-31,Internationaler Zebra Tag,International Zebra Day,https://www.kuriose-feiertage.de/internationaler-zebra-tag/,pets
153,01-31,Iss Rosenkohl Tag,Eat Brussels Sprouts Day in den USA,https://www.kuriose-feiertage.de/iss-rosenkohl-tag/,restaurant
154,01-31,Inspire Your Heart With Art Day,Lass Dich von Kunst inspirieren,https://www.kuriose-feiertage.de/inspire-your-heart-with-art-day/,brush
155,01-31,Sankt Nimmerleins Tag,Hell is Freezing over Day,https://www.kuriose-feiertage.de/sankt-nimmerleins-tag/,ac_unit
156,01-31,Tag der heißen Schokolade,National Hot Chocolate Day in den USA,https://www.kuriose-feiertage.de/tag-der-heissen-schokolade/,local_cafe
157,01-31,Rückwärts Tag,National Backward Day in den USA,https://www.kuriose-feiertage.de/rueckwaerts-tag/,undo
158,01-31,yaD drawkcaB lanoitaN,ehcsinakirema SU red gaT sträwkcüR,https://www.kuriose-feiertage.de/yad-drawkcab-lanoitan-ehcsinakirema-red-gat-straewkcuer/,rotate_left
159,01-31,Tag des Flaschenschraubverschlusses,Twist Off Bottle Cap Day,https://www.kuriose-feiertage.de/tag-des-flaschenschraubverschlusses/,emoji_food_beverage
160,02-01,Tag des Eurasiers,Eurasier-Feiertag in Deutschland,https://www.kuriose-feiertage.de/tag-des-eurasiers/,pets
161,02-01,Hula in the Coola Day,Hula in the Coola Day in den USA,https://www.kuriose-feiertage.de/hula-in-the-coola-day/,beach_access
162,02-01,Tag der Schlange,National Serpent Day in den USA,https://www.kuriose-feiertage.de/tag-der-schlange-usa/,emoji_nature
163,02-01,Ändere Dein Passwort Tag,Change Your Password Day in den USA,https://www.kuriose-feiertage.de/aendere-dein-passwort-tag/,lock
164,02-01,Robinson Crusoe Tag,Robinson Crusoe Day in den USA,https://www.kuriose-feiertage.de/robinson-crusoe-tag/,explore
165,02-02,Dicker Pulli Tag,Aktionstag zum Energiesparen,https://www.kuriose-feiertage.de/dicker-pulli-tag-in-deutschland/,ac_unit
166,02-02,Nackt zur Arbeit Tag,Working Naked Day in den USA,https://www.kuriose-feiertage.de/working-naked-day/,visibility_off
167,02-02,Tag der Tater Tots,Tater Tot Day in den USA,https://www.kuriose-feiertage.de/national-tater-tot-day/,fastfood
168,02-02,Spiel Deine Ukulele Tag,Play Your Ukulele Day weltweit,https://www.kuriose-feiertage.de/spiel-deine-ukulele-tag/,music_note
169,02-02,Küünlapäev in Estland,Kerzentag zu Mariä Lichtmess,https://www.kuriose-feiertage.de/kerzentag-in-estland/,emoji_objects
170,02-02,Bubblegum Tag,Bubble Gum Day in den USA,https://www.kuriose-feiertage.de/bubble-gum-day/,emoji_emotions
171,02-02,Zieh etwas Rotes an Tag,Wear Red Day in den USA,https://www.kuriose-feiertage.de/national-wear-red-day/,favorite
172,02-02,Tag des arbeitslosen Duftbaums,Tag des arbeitslosen Duftbaums,https://www.kuriose-feiertage.de/tag-des-arbeitslosen-duftbaums/,air
173,02-02,La Chandeleur,Crêpes-Tag in Frankreich,https://www.kuriose-feiertage.de/eierkuchenfest-in-frankreich/,restaurant
174,02-02,Tag des Igels,Hedgehog Day in den USA,https://www.kuriose-feiertage.de/tag-des-igels/,pets
175,02-02,Welttag der Feuchtgebiete,World Wetlands Day,https://www.kuriose-feiertage.de/welttag-der-feuchtgebiete/,waves
176,02-02,Groundhog Day,Murmeltiertag in den USA,https://www.kuriose-feiertage.de/groundhog-day/,nature_people
177,02-03,Tag der Ärztinnen,Women Physicians Day in den USA,https://www.kuriose-feiertage.de/tag-der-aerztinnen/,medical_services
178,02-03,Eis zum Frühstück Tag,Ice Cream For Breakfast Day in den USA,https://www.kuriose-feiertage.de/ice-cream-for-breakfast-day/,icecream
179,02-03,Tag der Eheringe,Wedding Ring Day in den USA,https://www.kuriose-feiertage.de/tag-der-eheringe/,ring_volume
180,02-03,Tag des Karottenkuchens,Carrot Cake Day in den USA,https://www.kuriose-feiertage.de/tag-des-karottenkuchens/,cake
181,02-03,The Day the Music Died,"R.I.P. Buddy Holly, Ritchie Valens und The Big Bopper",https://www.kuriose-feiertage.de/the-day-the-music-died/,library_music
182,02-04,Weltkrebstag,World Cancer Day,https://www.kuriose-feiertage.de/weltkrebstag/,healing
183,02-04,Erzeuge ein Vakuum Tag,Create a Vacuum Day in den USA,https://www.kuriose-feiertage.de/erzeuge-ein-vakuum-tag/,science
184,02-04,Tag der hausgemachten Suppe,Homemade Soup Day in den USA,https://www.kuriose-feiertage.de/tag-der-hausgemachten-suppe/,soup_kitchen
185,02-04,Danke einem Briefträger Tag,Thank a Mailman Day in den USA,https://www.kuriose-feiertage.de/danke-einem-brieftraeger-tag/,local_post_office
186,02-05,Tag der Wetterleute,Weatherperson’s Day in den USA,https://www.kuriose-feiertage.de/tag-der-wetterleute/,cloud
187,02-05,Runeberg Tag in Finnland,Nationalfeiertag zu Ehren von Johan Ludvig Runeberg,https://www.kuriose-feiertage.de/runeberg-tag-in-finnland/,flag
188,02-05,Welt Nutella Tag,World Nutella Day,https://www.kuriose-feiertage.de/world-nutella-day/,breakfast_dining
189,02-05,Hast du gepupst? Tag,Humorvoller Aktionstag,https://www.kuriose-feiertage.de/hast-du-gepupst-tag/,mood
190,02-06,Welttage ohne Mobiltelefon,World Days Without Phone,https://www.kuriose-feiertage.de/welttage-ohne-mobiltelefon/,no_cell
191,02-06,Internationaler Bob Marley Tag,Bob Marley Day auf Jamaika,https://www.kuriose-feiertage.de/bob-marley-day/,music_note
192,02-06,Tag der Essstäbchen,Chopsticks Day in den USA,https://www.kuriose-feiertage.de/tag-der-essstaebchen/,restaurant
